,url,Date,Title,Thank,Reply,author,title,context
57,/california/san-francisco/mayor-london-breed-public-defender-mano-raju-announce-young-defenders,2020-08-04T15:31:49Z,Mayor London Breed And Public Defender Mano...,0,0,Press Release Desk,News Partner,"Press release from the Office of the San Francisco Mayor:
August 03, 2020
Paid internship program, created in partnership with the Mayor's Office, Public Defender's Office, Human Rights Commission, and Teachers 4 Social Justice, provides 25 public high school students with a 40-week experience to learn about the criminal legal system and public defense
San Francisco, CA — Mayor London N. Breed and Public Defender Mano Raju today announced the creation of the San Francisco Young Defenders Program, a paid educational internship program to provide employment and mentorship opportunities to 25 local public high school students around criminal justice issues. The Young Defenders Program is part of the Opportunities for All initiative, which Mayor Breed created in 2018 to connect young people of all backgrounds to paid employment, job training, and mentorship opportunities.
The Young Defenders Program seeks to invest equitably in youth empowerment rather than the criminalization of youth, and ensure that youth of color have the opportunity to achieve a more successful future for themselves, their families, and their community. The program is the result of a unique partnership between Mayor Breed's Opportunities for All initiative, the Public Defender's Office, the Human Rights Commission, the San Francisco Unified School District, and Teachers 4 Social Justice. The internship program started last week with orientation, and the interns begin their placements with the Public Defender's Office today.
""I know firsthand how an internship can change the course of a young person's life,"" said Mayor Breed. ""We created Opportunities for All to empower youth and give them a chance to learn new skills and build professional connections, while also getting paid for their time. When we focus on providing opportunities for all of our young people, those youth go above and beyond to prove themselves and then succeed in ways they and others never imagined. This program invests in communities that have historically been left behind and opens up opportunities that otherwise would have been out of reach. I want to thank all the partners who have worked to make the Young Defenders program a reality, especially at a time when it's more important than ever that we're making concrete investments in supporting communities of color.""
""I am proud that we are launching the Young Defenders Program at this moment in time, as the movement for Black Lives Matter continues to build momentum across the country, and young people are calling for racial justice and changes to the laws and practices that directly affect their lives,"" said Mano Raju, Public Defender of San Francisco. ""Through this program we have an opportunity to train and educate young San Franciscans on how the criminal legal system works and how public defenders advocate for people through every step of the process. My hope is we can start to build a new pipeline of diverse Public Defenders and criminal justice advocates through this program.""
The San Francisco Public Defender's Office is lauded as one of the premier public defender offices in the country, with a deep commitment to community engagement and achieving structural reforms to the criminal legal system locally and statewide. The Young Defenders Program is in line with the Public Defender's commitment to close the school to prison pipeline, as evidenced by its community-based M.A.G.I.C. programs which connect youth and families to opportunities and resources in the Bayview and the Fillmore-Western Addition neighborhoods. The Young Defenders Program is an opportunity to further guide and empower young San Franciscans through direct mentorship.
Over the course of 40 weeks, Young Defenders will hear lectures from guest speakers, be paired with defense attorneys and social workers to complete weekly assignments, participate in group projects such as mock trials, and develop virtual community outreach events on topics such as knowing your rights, increasing the diversity of juries, and facilitating restorative justice. Many will also earn academic credit toward high school graduation while earning minimum wage for up to 15 hours a week. Due to COVID-19, students will participate in the program remotely for the time being, and will be provided the technology they need for remote work.
The first group of Young Defenders were selected for the program through an interest survey following their summer internship with Opportunities for All. Opportunities for All and the Mayor's Office will fund the youth stipends, and the Public Defender's Office will fund the program through staff time and service hours. As many families are struggling financially due to COVID-19, it is more important than ever that students have access to paid internship opportunities.
""The purpose of this program is to expose students to the world of criminal justice from the perspective of the Public Defender's Office while inspiring students to use their own power as educators and activists for change,"" said Athena Edwards, Senior Fellow, Opportunities for All.
""I like that this cohort is teaching me things that I need to know about the law and my rights,"" said Aniyah, a San Francisco native and rising junior at Raoul Wallenberg High School. ""I also like my Fellows. They're very creative in leading our activities and our group conversations and even though these things can be tricky, it's fun trying new things. I enjoy being a part of this cohort and getting to experience different job techniques, while doing activities outside of my comfort zone.""
""It's a good opportunity for me to learn about criminal justice,"" said Shamira, a San Francisco native and rising sophomore at KIPP San Francisco College Prep. ""Last week in orientation, we did our first presentation. My partner and I focused on Breonna Taylor, and how the police who killed her have not been arrested. We learned a lot about laws, but also used our own knowledge and understanding for the presentation.""
""I'm excited to be starting my second year interning with Opportunities for All,"" said India Brar, a student joining the Young Defenders program. ""I am extremely passionate about helping people especially ones in need and believe that being placed with San Francisco's Young Defenders program was not only more than I could've asked for, but will allow me to make a difference which is something I am looking forward to.""
Since taking office, Mayor Breed has consistently prioritized funding for programs that make San Francisco more equitable. As announced on Friday, the Mayor's budget continues to prioritize equity, with funding both from the General Fund and redirected from the City's law enforcement departments. Mayor Breed has proposed using funding to reinvest in the African American community and to repair the legacy of racially disparate policies on health, housing, and economic outcomes for African Americans in San Francisco.
In addition to redirecting funding from law enforcement departments, the Mayor's budget includes ongoing and new investments from the General Fund to support vulnerable populations throughout San Francisco, prioritizing several children- and youth-focused initiatives that will ensure more equitable outcomes for future generations of San Franciscans. Specifically, the Mayor's proposed budget for Fiscal Years 2020-21 and 2021-22 includes $5.5 million in funding from the General Fund to continue the Opportunities for All program.
""I am grateful for the ability to connect Opportunities for All with Teachers 4 Social Justice and the Public Defender's office to launch this program,"" said Sheryl Davis, Executive Director, Human Rights Commission. ""Opportunities for All provides young people with the opportunity to not just develop skills and build their social networks, but programs like the Young Defenders, centers youth voice, encourages and empowers youth to address issues of inequity, to transform systems and challenge business as usual. I look forward to learning from the youth and seeing the impact they will have in the community and the criminal justice system.""
""This is the City, the School District and community based organizations working together to do the most for young people, especially during this time,"" said Jeremiah Jeffries, public school teacher and coordinator for Teachers 4 Social Justice. ""SF Young Defenders is a concrete example of where we should be reallocating funding to, away from policing and criminalization of youth, toward education and giving youth a foundation to build careers focused toward justice.""
""In my role as Board of Education Commissioner and Education Advisor to the Mayor, the creation of SF Young Defenders is the fulfillment of one of the many promises we asked the public to trust us to fulfill,"" said Jenny Lam, Commissioner, San Francisco Board of Education. ""The potential I see in these young people and in this opportunity is why cross institution and community partnerships can be so powerful and should be the rule not the exception for how to get things done for young people.""
In October 2018, Mayor Breed announced the launch of Opportunities for All (OFA), a program to address economic inequality by ensuring that all young people can be a part of San Francisco's thriving economy and explore different career paths. In the first full summer of the OFA program in 2019, there were more than 3,800 total placements, including at least 1,500 new placements.
To date, the summer 2020 OFA cohort has placed over 1,400 youth in internships. Additionally, 68 Opportunities for All Fellows and 12 Senior Fellows were placed. Fellows are college aged young adults who work directly with high school students, creating project design, and developing their projects and presentations. OFA introduced the Senior Fellow position this year, 12 upper-class college students, and postgraduates, who each managed a small group of Fellows, offering daily, direct engagement, facilitating meetings, and supporting the project design for their cohorts.
This press release was produced by the Office of the San Francisco Mayor. The views expressed here are the author's own."
58,/california/san-francisco/mayor-london-breed-announces-launch-san-francisco-public-library-go,2020-08-02T08:03:18Z,Mayor London Breed Announces Launch Of San...,0,0,Press Release Desk,News Partner,"Press release from the Office of the San Francisco Mayor:
August 01, 2020
San Francisco Public Library cardholders can soon start to pick up materials at the front doors of select library locations
San Francisco, CA — Mayor London N. Breed and City Librarian Michael Lambert today announced the launch of SFPL To Go, which will enable San Francisco Public Library cardholders to pick up and return their materials at select library locations throughout the City. The new program will roll out in phases with the first locations opening at the Main Library on Monday, August 10th and at the Excelsior Branch on Tuesday, August 11th.
""The San Francisco Public Library has significantly increased digital access to its collection during the COVID-19 health emergency, but I know that for many of us nothing replaces the feeling of holding and reading a physical book,"" says Mayor Breed. ""The launch of SFPL To Go will allow for pick-up and drop-off in a safe and convenient way, and will help provide greater access to resources for our youth who will need extra support to ensure that this academic year is a success. I want to recognize Library staff for their tremendous contributions to the City's COVID-19 response efforts, from contact tracing to food distribution and community outreach, along with their continued commitment to keeping our Library operating and accessible to all our residents.""
On July 9th, the San Francisco Public Library Commission endorsed a plan for SFPL To Go, the Library's version of curbside pick-up. Over the coming weeks, the Library will open more SFPL To Go locations at Mission Bay, Eureka Valley, Merced, and Marina branches. Additional neighborhood libraries will offer the service as staffing capacity allows. Almost half of the Library's staff are currently deployed as Disaster Service Workers.
Each location will operate under a City-approved Health and Safety Plan and will follow all masking and social distancing requirements and OCLC and Institute of Museum and Library Services' strict guidelines for materials handling.
""Books are back!"" says City Librarian Michael Lambert. ""We are thrilled to launch SFPL To Go and to see all of our patrons again at our front doors. We thank everyone for their patience as we implement contact-free service throughout the City. As we look ahead, Library staff will continually reevaluate our operations and develop safety protocols for the next phases of service.""
Library patrons can request a book, DVD, audiobook, LP or any circulating library item for front door pick-up by going to sfpl.org and placing a hold through their library account; by emailing info@sfpl.org or by calling 415-557-4400. Once the item is ready, patrons will receive a notice for retrieval. Book drops will be open only at SFPL To Go locations during operating hours.
All patrons are encouraged to release any holds they may no longer want by August 7th, so that staff can focus on fulfilling current requests. Materials checked out pre-closure are not due until September 30th. As SFPL is Fabulously Fine Free, there are no late fees. For more information, visit sfpl.org/sfpl-to-go.
This press release was produced by the Office of the San Francisco Mayor. The views expressed here are the author's own."
59,/california/san-francisco/mayor-london-breed-supervisor-matt-haney-announce-new-pedestrian-spaces,2020-08-02T07:53:40Z,Mayor London Breed And Supervisor Matt Haney...,0,1,Press Release Desk,News Partner,"Press release from the Office of the San Francisco Mayor:
July 31, 2020
San Francisco will implement a 4-block temporary project on Jones Street, while rolling out Shared Spaces and Play Streets for pedestrian space in the Tenderloin for maintaining physical distance
San Francisco, CA — Mayor London N. Breed and Supervisor Matt Haney today announced the creation of new pedestrian spaces to support residents and businesses in the Tenderloin, which has been especially hard-hit by COVID-19. The City will temporarily refashion San Francisco streets, including the implementation of sidewalk expansions, the Play Streets program, and the Shared Spaces program. In the coming days, the San Francisco Municipal Transportation Agency (SFMTA) will implement a 4-block temporary project on Jones Street, from O'Farrell Street to Golden Gate Avenue for residents to have more pedestrian space in the Tenderloin while maintaining physical distance.
""We know that it's been difficult for people to maintain physical distance on sidewalks when going out for essential outings in the Tenderloin, and these changes will make it easier for people to get around their neighborhood safely,"" said Mayor Breed. ""COVID-19 has also made it difficult for our businesses, and thanks to our Shared Spaces Program, more restaurants in the Tenderloin will be able to use outdoor space to operate, which will support the economic and physical health of our entire community.""
""The Tenderloin not only deserves but desperately needs streets that are re-designed to meet the needs of the residents, essential workers, businesses, families, and seniors,"" said Supervisor Haney. ""With the critical guidance of the Tenderloin Traffic Safety Taskforce and many other stakeholders, I'm excited that this set of projects is being implemented.""
The Tenderloin is a dense neighborhood with a high percentage of low-income residents, people of color, seniors, and transit-dependent San Franciscans who need more space for physical distancing and making essential trips. With support from Mayor Breed and Supervisor Matt Haney, the SFMTA will implement the following efforts in the Tenderloin to address community needs starting next week:
From the beginning of the City's COVID-19 response, the SFMTA has supported the Tenderloin community through changes such as a parking lane closure at the pop-up test site on Ellis Street, daytime street closure in front of St. Anthony's at the 100 block of Golden Gate, and a parking lane removal for more pedestrian-queuing space at GLIDE on the 300 block of Ellis. The City and SFMTA will continue to support additional community needs, such as curb changes needed to support testing sites and food pantries, both the short-term and into the future.
""The Tenderloin has San Francisco's highest concentration of vulnerable residents and highest concentration of traffic crashes. It also has the highest rate of emergency service calls. The street safety and design approaches that work in other neighborhoods did not work in the Tenderloin"" said Jeffrey Tumlin, SFMTA Director of Transportation. ""We're grateful to the creativity of community-based organizations, the Fire Department, and other partners for helping us find creative solutions that work for the unique needs of Tenderloin residents.""
Several Tenderloin community groups have been important partners with the City and SFMTA in the effort to create these programs. These groups include the Central City SRO Collaborative, Tenderloin Community Benefit District, Tenderloin Neighborhood Development Corporation, and the Tenderloin People's Congress.
""We're happy the Jones project has gone forward, but it is only just the beginning of broader shift towards a more equitable future that puts the Tenderloin's residents — not car traffic — first,"" said Evan Oravec, co-chair of the Tenderloin Traffic Safety Taskforce.
More details on the City's COVID-19 Response for Tenderloin streets can be found here: https://www.sfmta.com/news-blog
This press release was produced by the Office of the San Francisco Mayor. The views expressed here are the author's own."
