,url,Date,Title,Thank,Reply,author,title,context
92,/california/san-francisco/liu-poll-reveals-what-americans-are-thinking-pres-debate,2020-09-28T20:42:05Z,LIU Poll Reveals What Americans Are Thinking...,0,0,Donald Stone,Community Contributor,"This post was contributed by a community member. The views expressed here are the author's own.
Results of a breaking Long Island University Steven S. Hornstein Center for Policy, Polling and Analysis pre-debate national poll were announced on the eve of the first presidential debate for Election 2020.
HIGH VIEWERSHIP EXPECTED
National poll results found that 75 percent of Americans are following closely news about candidates for the 2020 presidential election. A high viewership is expected with 78 percent of Americans saying they plan to tune into watch President Donald Trump debate former Vice President Joe Biden on Tuesday, Sept. 29, 2020.
BIDEN IN THE LEAD:
BIDEN 48%; TRUMP 30%; UNDECIDED 10%; ANOTHER CANDIDATE 5%The importance of presidential debates is widely known to influence voters. Before the presidential debates kick off on Tuesday evening, Americans were asked who they would vote for if the election were held today. Respondents said they would vote today for Biden (48 percent), Trump (30 percent), and another candidate (5 percent). An additional 10 percent of respondents said they were undecided and 6 percent said they wouldn't vote if the elections were held today. Respondents also believe that Biden will do a better job in the debate. Among respondents, 43 percent of Americans believe that Biden will do a better job in the debate, while 32 percent believe that Trump will have a stronger performance.
ECONOMY IS THE ONE ISSUE THAT MATTERS MOST FOR VOTERS
While a variety of reasons were mentioned, the one issue that mattered most on deciding how to vote among respondents was the economy (26 percent). Following close behind was racial inequality (13 percent), health care (11 percent), coronavirus (10 percent), and law and order (10 percent). Americans between the age of 30 and 60 and those with higher household income reported the economy at a higher rate as the most important issue than other demographics. Americans between the age of 18 and 29 reported racial inequality at double the rate of other age demographics (24 percent).
MINDS MADE UP
Among respondents, the majority of Americans (73 percent) say their mind is made up on their election vote, while 14 percent say they might change their minds and 13 percent say they aren't sure.
VOTER LIKELIHOOD
Among the respondents, 87 percent said they are likely to vote in the November elections (1,314 total likely voters).
IN-PERSON VOTING - METHOD OF CHOICE
Among the respondents, 47 percent of Americans said they plan to vote in person, 36 percent plan to mail in their ballot, and 17 percent said they still aren't sure. Americans over the age of 60 plan to mail in their ballot at a higher rate than other demographics.
METHODOLOGY
This Long Island University Steven S. Hornstein Center for Policy, Polling & Analysis online poll was conducted through SurveyMonkey from September 24-26, 2020 among a national sample of 1,508 adults ages 18 and up. Respondents for this survey were selected from the nearly three million people who take surveys on the SurveyMonkey platform each day. Data for this week have been weighted for age, race, sex, education, and geography using the Census Bureau's American Community Survey to reflect the demographic composition of the United States. The modeled error estimate for this survey is plus or minus 3.5 percentage points.
ABOUT THE LONG ISLAND UNIVERSITY STEVEN S. HORNSTEIN CENTER FOR POLICY, POLLING, AND ANALYSIS
The Long Island University Steven S. Hornstein Center for Policy, Polling, and Analysis conducts independent polling, empirical research, and analysis on a wide range of public issues. Our studies inform the public and policy makers about critical issues, attitudes, and trends shaping the world. Faculty and scholars from all schools of study at Long Island University participate in data collection and analysis. Visit liu.edu/Hornstein for more information and results from the pre-debate national poll.
ABOUT LONG ISLAND UNIVERSITY
Long Island University, founded in 1926, continues to redefine higher education, providing high quality academic instruction by world-class faculty. Recognized by Forbes for its emphasis on experiential learning and by the Brookings Institution for its ""value added"" to student outcomes, LIU offers over 250 degree programs, with a network of 270,000 alumni that includes industry leaders and entrepreneurs across the globe. Visit liu.edu for more information."
93,/california/san-francisco/mayor-london-breed-announces-leadership-transition-department-human,2020-09-28T16:13:07Z,Leadership Change At The City's Department Of...,0,0,Press Release Desk,News Partner,"Press release from the Office of the San Francisco Mayor:
September 25, 2020
Human Resources Director Micki Callahan is retiring from City government, and Carol Isen will assume role of Acting Director
San Francisco, CA — Mayor London N. Breed and Human Resources Director Micki Callahan today announced a transition plan when Director Callahan retires from City government in October after 15 years of service, 13 as the Human Resources Director and two as the Employee Relations Director. This follows on Director Callahan's previous announcement in June that she was planning to retire in October. Current Employee Relations Director, Carol Isen, will serve as Acting Director of Human Resources while a comprehensive search for the Human Resources Director position is being undertaken by the Civil Service Commission. Amalia Martinez, currently an Employee Relations Manager, will serve as Acting Employee Relations Director.
""Micki Callahan has been an invaluable leader and public servant for the City,"" said Mayor Breed. ""San Francisco has been lucky to have her leadership during this most recent COVID crisis when our entire workforce has faced unprecedented uncertainty and challenges, as well as in the years going back to our last economic crisis when she led us through the Great Recession. Micki has spearheaded groundbreaking equity and social justice initiatives, and she has managed challenging negotiations and modernized our hiring system with a combination of determination and grace that has served our City well. I wish her all the best in her retirement.""
""It has been a pleasure to serve the City and County of San Francisco for the last 15 years, and to work on many transformative initiatives such as pension reform, the implementation of implicit bias training, and our conviction history program,"" said Micki Callahan, Human Resources Director. ""Carol Isen is an excellent choice to serve as Acting Human Resources Director and is well suited to work with all city departments, labor partners, and community stakeholders to continue to keep the San Francisco at the forefront of life-changing workforce policies.""
In her 15 years at the Department of Human Resources, Director Callahan was responsible for administration of the City's civil service system and human resources programs, including labor relations, workers compensation, workforce development, equal employment opportunity, and recruitment and assessment. She led negotiations during the 2008 great recession, and she led the bargaining process for pension and retiree health reform twice, in 2007 and 2011 and played a critical role in ensuring that medical benefits remain affordable for active employees and their families. She also launched a multi-year, multi-faceted Hiring Modernization Program.
Director Callahan spearheaded several initiatives focused on equity and social justice. She led the ""ban the box"" efforts for City hiring in San Francisco through the creation of a nationally recognized Conviction History program, implemented the City-wide Gender Inclusion Policy, and expanded training opportunities, notably overseeing the development and recent major expansion of Implicit Bias training. Under her direction, San Francisco is now the first major employer in the State of California to provide electronic payments of Workers' Compensation benefits.
Director Callahan has also served as San Francisco's Employee Relations Director. Before joining City management, she worked at the State Mediation and Conciliation Service for 10 years, serving as the Supervisor of Conciliation from 2000 through 2005. Before she became a mediator, she spent 14 years working as a union representative. Callahan received her BA in Economics from the University of Massachusetts at Amherst.
Since 2017, Carol Isen has served in the capacity of Employee Relations Director for the City and County of San Francisco.
""I want to thank Carol for stepping up to lead at this critical time for our city,"" said Mayor Breed. ""Carol brings a tireless work ethic and decades of experience working with labor and city workers across different departments and regional agencies. She has a deep understanding of the role labor relations and Human Resources play in ensuring our workplaces are safe, fair, and create equitable work opportunities. I know she is focused on meeting our goals of increasing diversity and supporting equity, and I look forward to working with her in this important role.""
""At such a pivotal time for our city, I am honored and humbled to continue to serve the City and County of San Francisco as the Acting Human Resources Director,"" said Carol Isen, Director of Employee Relations. ""The Department of Human Resources is uniquely positioned to tackle the bold, aspirational and, achievable goals of building and embracing a more diverse and inclusive workforce in which our employees at all levels reflect our communities and where our differences are celebrated and valued. Achieving these goals will only improve the delivery of high-quality services to the thousands of San Francisco residents that we serve each day. I am looking forward to leading a department that is focused on these ideals and works in collaboration with community partners to achieve them.""
Ms. Isen has been involved in labor and employment advocacy and representation in San Francisco government since 1984. From 1984 to 2003, Ms. Isen was an organizer, negotiator and Associate Director for the International Federation of Professional and Technical Engineers (IFPTE), Local 21.
Ms. Isen previously served as the Director of Labor Relations and Community Programs for the San Francisco Public Utilities Commission and as Chief Labor Relations Officer for BART. She is widely considered an expert in the field of labor and industrial relations, had served as chief negotiator in many bay area public agencies, on the employer and union side, was the chief negotiator for several ground-breaking project labor agreements. She has a deep commitment to civil rights in the workplace, merit system employment and promoting community development through job training and opportunities. She received her MA degree from the University of Michigan, Residential College, and her MA Degree from the University of California at Berkeley, Department of City and Regional Planning.
""Frontline public workers deserve fair and transparent leadership at the head of this important agency,"" said Rudy Gonzalez, Executive Director of the San Francisco Labor Council. ""Carol Isen's appointment brings experience and credibility to this important post. We also appreciate that Ms. Isen's appointment as an LGBTQ leader stands as a statement of inclusion and diversity for the City's workforce.""
Amalia Martinez was an employee and labor relations lead at the University of California, Berkeley starting in 2017 until beginning her career with the City almost a year ago. She is a graduate of the University of Chicago and DePaul University College of Law. She has 11 years of experience in investigating claims of employment and housing discrimination for the Illinois Department of Human Rights. During that time, Ms. Martinez supervised a team of lawyers and handled a voluminous caseload. She was raised in Chicago along with her four siblings by a single mother.
The Department of Human Resources provides human resource services to approximately 60 city departments, with a total workforce of over 38,000 employees.
This press release was produced by the Office of the San Francisco Mayor. The views expressed here are the author's own."
94,/california/san-francisco/mayor-london-breed-announces-program-outdoor-entertainment-amplified-sound,2020-09-28T15:58:40Z,Mayor Announces Program For Outdoor...,0,0,Press Release Desk,News Partner,"Press release from the Office of the San Francisco Mayor:
September 25, 2020
The Entertainment Commission's JAM or ""Just Add Music"" permit will regulate entertainment and amplified sound at Shared Spaces locations, private business property, and other outdoor settings. Permit is available at no cost.
San Francisco, CA — Mayor London N. Breed today announced a new temporary permit program to ensure safer outdoor entertainment and amplified sound activity as a part of San Francisco's gradual reopening. Administered by the Entertainment Commission, the new JAM or ""Just Add Music"" permit will help businesses, organizations, and individuals hold responsible entertainment activity at Shared Spaces and other outdoor locations consistent with public health rules.
Prior to this permit process, businesses that wanted to offer outdoor entertainment or amplified sound at their venue during the COVID-19 pandemic had to either apply for one-day permits—limited to 12 days a year at an expense of hundreds of dollars per day—or pursue a multi-month permitting process that could require an Entertainment Commission hearing. The JAM permit program provides a free and streamlined pathway for the arts, entertainment, and nightlife sectors to support their business livelihoods by adding music and other cultural activity in a way that is safe and follows public health guidelines. The JAM Permit application portal is available at sf.gov/jam.
""This program will provide some much-needed relief for businesses that are looking for ways to safely offer outdoor entertainment and music and survive the economic challenges of COVID-19,"" said Mayor Breed. ""San Francisco is a world-class entertainment city and we are fortunate to have a diverse entertainment and nightlife culture -- we can't let COVID take that away from us. We're adapting our permitting processes to meet this moment and ensure businesses have the guidance they need to operate safely and in compliance with City rules.""
The JAM permit comes at a pivotal time for San Francisco businesses, as arts, entertainment, and nightlife businesses are at risk of permanent closure or displacement due to the financial impacts of COVID-19. These businesses and employees have experienced devastating losses of income during the global pandemic. According to a May 2020 survey of 169 entertainment and nightlife industry workers conducted by the Entertainment Commission:
Given the uncertain course of the pandemic, these losses may continue until a vaccine is available and widely distributed. San Francisco continues to evaluate ways to bring activities, including indoor bars, music venues, performance spaces, and nightlife back safely, but these indoor activities currently remain closed. In the meantime, ensuring that outdoor cultural activity happens safely and in compliance with public health rules provides businesses with an opportunity for additional revenue and could help them survive.
""I am thrilled to launch this program as a part of San Francisco's safe reopening plans at a time when our beloved arts, entertainment and nightlife businesses need it most,"" said Maggie Weiland, Executive Director of the Entertainment Commission. ""The JAM Permit creates a legal pathway for businesses to hold responsible, vibrant entertainment activities--and supports their livelihoods and social well-being for all San Franciscans. Our permit holders are creators and curators of our City's culture, their contributions will amplify our City's values and resilience.""
""Arts and entertainment will be the main driver of San Francisco's economic and cultural recovery, not just a part of it,"" said Entertainment Commission President Ben Bleiman ""JAM permits are a crucial step for the survival of venues, artists, and performers across the city.""
""The recovery of our arts and entertainment sectors are critical to both our economy and our City's cultural fabric,"" said Joaquín Torres, Director of the Office of Economic and Workforce Development. ""The launch of this program represents a significant step in the City's safe reopening and creates more opportunities for our communities to enjoy what makes San Francisco hum with life. It's good for merchants, artists and entertainers who care deeply about enlivening our neighborhoods.""
""We're really excited for the JAM permit launch,"" said Aaron Paul, co-owner of Macondray, a bar and restaurant on Polk Street. ""I opened Macondray as a first time small business owner with my business partner Jake Roberts mere months before COVID happened. Over the past several months, we have had no option to move our music offerings outside. The JAM permit will allow us to add music to our outdoor Shared Space, while providing a vibrant and positive experience for our guests.""
""As the owner of Vesuvio in North Beach, I am very grateful the ""Just Add Music"" permit will allow us to program live music in Jack Kerouac Alley without a cumbersome or expensive bureaucratic process,"" said Janet Clyde, owner of Vesuvio. ""We look forward to working with our neighbors and the community of San Francisco musicians to make this program a success! Thank you Mayor Breed, Director Weiland, and everyone who made this possible!""
The JAM Permit aligns with and enhances the Shared Spaces program by creating a pathway for businesses to add safe, vibrant cultural activity to outdoor dining and retail spaces. Launched in June, Shared Spaces allows neighborhood businesses to share a portion of the public right-of-way, such as sidewalks, streets, or other nearby public or private spaces for dining and retail activity, as allowed by San Francisco's Public Health Order. The program allows individual businesses or local merchant associations to apply for a no-cost, expedited permit. The City has issued 1,600 Shared Spaces permits to date.
The San Francisco Department of Public Health (DPH) will continue to monitor the spread of COVID-19 infection as more of the city population circulates and interacts. DPH will continue to monitor the City's Key Public Health Indicators to ensure San Francisco's gradual reopening and allowance of outdoor entertainment and amplified sound activity does not drive a surge in infections and hospitalizations.
The following locations and activities are eligible to apply for a permit:
Businesses with questions about the permit process should go to sf.gov/jam and can contact the San Francisco Entertainment Commission at: entertainment.commission@sfgov.org, 628-652-6030 with additional questions.
This press release was produced by the Office of the San Francisco Mayor. The views expressed here are the author's own."
