,url,Date,Title,Thank,Reply,author,title,context
17,/florida/lakeland/transit-tax-turmoil-hillsborough-county,2018-09-14T09:00:00Z,The Transit Tax Turmoil in Hillsborough County,0,0,E. Eugene Webb PhD,Community Contributor,"This post was contributed by a community member. The views expressed here are the author's own.
St. Petersburg, Fl
Opinion by: E. Eugene Webb PhD
Author: In Search of Robin, So You Want to Blog.
There are bad tax proposals and then there are really bad tax proposals like the one being offered to Hillsborough County residents on the November Ballot. This Ballot initiative has enough holes in it to embarrass a block of Swiss cheese.
If you are considering voting YES on this Referendum, you will need to do some serious research. Below are a bunch of links to articles and Blog Posts about the referendum and the use of the funds it will generate.
Here is the link to the Hillsborough County General Election Sample Ballot
From Eye on Tampa Bay by Sharon Clavert
August 11, 2018 Ferry Dust Saturday
August 12, 2018 It's a Dud! Press Conference For Vinik's Massive Rail Tax Hike
August 13, 2018 Vinik's Massive Transit Tax Hike Is Another Boondoggle!
August 16, 2018 Vinik's 30 Year ""All for Transit"" Tax Hike Constrains Roads, Creates Gridlock - Vote NO!
August 19, 2018 What They Say, What They Do
August 22, 2018 All for Transit Tax Hike: Costly and Won't Work
August 23, 2018Pay to Play On The Ballot
From Tampa Bay Beat by Jim Bleyer
August 5, 2018 Transportation Experts Slam Hillsborough Light Rail Plans, Higher Sales Tax
August 13, 2018 OPPAGA Counsel, Like Sgt. Schultz, Knows Nothing
Tampa Bay Guardian by Tom Rask
July 7, 2018 Sloppy transit sales tax effort raises question – is Water Street on the skids?
September 7, 2018 State agency hides the ball on Hillsborough transit tax hike, info funneled to friendly media instead
Tampa Bay Times
June 15, 2018 Petition language reveals details of Hillsborough sales tax transportation initiative
August 8, 2018 Petition succeeds, Hillsborough voters set to decide on sales tax hike for transportation
August 9, 2018 After making the ballot, All for Transportation launches Hillsborough campaign
August 9, 2018 Editorial: A big first step toward improving transportation in Hillsborough
August 23, 2018 Tampa would use transit tax proceeds to quicken improvements, not revamp plans
August 23, 2018 Tampa chambers, downtown partnership back transportation sales tax initiative.
The end game is this. This All Florida Transportation initiative is even more poorly conceived, planned and promoted than Greenlight Pinellas and Go Hillsborough.
The revenue from this tax is controlled by an unknown board appointed by unnamed elected officials. The tax applies to all residents of Hillsborough County, but a significant portion of the funds goes to just three Cities. Another large chunk goes to HART the Hillsborough County Bus line. They're very inadequate controls and a significant lack of accountability.
It may be time for a tax to support transportation improvement in Hillsborough County, but this proposal is a light rail/developer's delight not a commuter's solution.
E-mail Doc at mail to: dr.gwebb@yahoo.com or send me a Facebook (E. Eugene Webb) Friend request. Like or share on Facebook and follow me on TWITTER @DOC ON THE BAY.
See Doc's Photo Gallery at Bay Post Photos."
18,/florida/lakeland/deaths-lakelands-signature-swans-ruffling-feathers,2018-09-04T14:37:05Z,City To Consider Ways To Better Protect The Swans,0,0,D'Ann Lawrence White,Patch Staff,"LAKELAND, FL – The graceful bevy of swans that has served as the city of Lakeland's mascot for 60 years may be dying out.
In the last three weeks, six swans trying to cross Lake Morton Drive, which circles Lake Morton, have been struck by cars.
One of the swans survived and is being nursed back to health by Dr. Patricia Mattson of Companion Animal Hospital, who cares for the city's swans that live on Lake Morton and Lake Mirror.
Mattson said the swan was lucky. It only has a bruised wing and will most likely be released back into the lake this week.
The other swans suffered painful deaths, she said.
The deaths of the regal creatures is ruffling feathers at city hall. The city has posted a plea on its social media sites for motorists to keep an eye out for swans crossing to road.
Additionally, city officials and nearby residents plan to meet Thursday, Sept. 6, to discuss ways to slow or reduce traffic around the lake to prevent further swan deaths.
The 70 swans on the lake are the descendants of a pair of swans from Queen Elizabeth II's world-famous collection in England. They were shipped from England to Lakeland in 1957.
Since then, the birds, which weigh up to 50 pounds, have been cared for by the city and are protected by city ordinance. Anyone who intentionally harms a swan can be charged with a crime.
The city has been conscientious about making sure the birds are cared for and healthy. Each year the city holds a swan roundup, giving each swan a checkup and any needed veterinary care in assembly line fashion.
While the swans appear to float effortlessly across the lake, their pace out of the water is hardly elegant. Their slow, clumsy walk leaves them vulnerable to the 4,600 vehicles that use Lake Morton Drive each day.
Suggestions from residents on the city's Facebook page to prevent further swan deaths include the installation of ""Swan Crossing"" signs, speed humps, tougher penalties for distracted drivers who run over swans, a larger law enforcement around the lake and making Lake Morton Drive a one-way road.
""Please put speed bumps in,"" said Natalie Slater. ""I see people driving too fast and don't even bother to slow down when the swans or any other birds are crossing the street. They also don't slow down when there are kids near the street.""
""Swans mate for life so when one is killed, its mate suffers as well,"" said B.J. Miller. ""We should better protect our beautiful swan community. They are truly Lakeland's brand. We all hate speed humps so adding multiple ones around Lake Morton sounds reasonable.""
Images via city of Lakeland
(For more local news from Florida, click here to sign up for real-time news alerts and newsletters from Patch. If you have an iPhone, click here to get the free Patch iPhone app; download the free Patch Android app here.)"
19,/florida/lakeland/primary-results-polk-county-school-board-winners,2018-08-29T03:23:53Z,Polk County Elects New School Board Members,0,0,D'Ann Lawrence White,Patch Staff,"LAKELAND, FL -- Here are the unofficial results of the Polk County School Board races with all 167 precincts reporting.
School Board District 3
Sarah Fortney 32.29 percent
Scott Jones 31.44 percent
Kala Tedder 18.92 percent
LaTrice Moore 17.36 percent
School Board District 5
Kay Fields 37.38 percent
Jennifer Sabin 31.57 percent
Terry L. Clark 31.05 percent
School Board District 7
Lisa Miller 56.01 percent
David Byrd 43.99 percent
Image via Shutterstock
(For more local news from Florida, click here to sign up for real-time news alerts and newsletters from Patch. If you have an iPhone, click here to get the free Patch iPhone app; download the free Patch Android app here.)"
20,/florida/lakeland/tell-patch-if-you-see-election-shenanigans-polk-county,2020-09-09T13:43:15Z,Tell Patch If You See Election Shenanigans In...,0,0,Skyla Luckey,Patch Staff,"LAKELAND, FL — The high-stakes 2020 presidential and general election is two months away, but voting is already underway in some parts of the country. The coronavirus pandemic is increasing interest in mail-in balloting — something about 100 million people are eligible to do without giving an ""excuse"" or reason.
Because of the surge in absentee balloting in Polk County and elsewhere, the nonprofit investigative news organization ProPublica has launched its Electionland tip lines early this year. Patch has joined the coalition of newsrooms participating in the Electionland project to discover problems that prevent eligible voters from accessing or casting their ballots during or ahead of the Nov. 3 general election.
Patch participated in the Electionland project in the 2016 election, working with ProPublica to bring you information on broken scanners and long lines at the polls in Brooklyn, the extension of voting hours in Durham County, North Carolina, due to technical issues, voting improprieties in Texas, an election day shooting in Azusa, California, and much more.
ProPublica wants to hear about any problems that may prevent people from voting — for example, mail ballot delivery problems, voting location changes, long lines, registration problems, purged voter rolls, broken machines and voter intimidation.
Our journalists and those at other newsrooms taking part in the Electionland project will do what we can to document and verify what readers tell us about voting and Election Day experiences. One of the most important parts of the Electionland project is to hear directly from voters. There are several ways to do that:"
21,/florida/lakeland/polk-county-school-board-other-primary-election-results-2020,2020-08-19T01:57:12Z,"Upsets In Polk County School Board, Commission...",0,0,Skyla Luckey,Patch Staff,"LAKELAND, FL — Polk County voters headed to the polls Tuesday to choose Polk County School Board members and commissioners who will face off in the general election Nov. 3. Voters ousted an incumbent school board member and a commissioner in the Aug. 18 primary election.
Incumbent John Hall's fear of losing the county commission race to challenger Neil Combee came true with unofficial results reporting that Combee captured 50,708 votes, 53.56% and Hall got 43,813 votes, 46.35%.
Combee has previous experience serving on the county commission from 1988 to 2004.
During the campaign, Combee attacked Hall as a ""big government, tax-and-spend liberal"" and a ""career bureaucrat,"" in his campaign mailers, the Lakeland Ledger reported.
An upset Anita Carson who received 41,716 votes compared to incumbent Lori Cunningham's 56,073 votes expressed her disappointment on her Facebook campaign page: ""Tonight did not go the way we were hoping, but I promise to continue to work toward bringing positive changes to benefit our students, staff and community.""
Here are the unofficial results, according to the Polk County Election Office:
County Commissioner, District 5 - Universal Primary Contest
Neil Combee (R) 53.65%, 50,708 votes
John E. Hall (R) 46.35%, 43,813 votes
State Committeewoman
Kat Gates-Skipper (R) 37.00%, 16,239 votes
Amilee M. Stuckey (R) 40.19%, 17,637 votes
Glynnda White (R) 22.81%, 10,009 votes
Precinct Committeeman
John A. Davenport (R) 31.20%, 122 votes
Steven P. Graves (R) 18.67%, 73 votes
James L. Moyer (R) 17.39%, 68 votes
Raymond Para (R) 32.74%, 128 votes
State Representative, District 56
Eric Bautista (D) 41.08%, 2,131 votes
James Davis (D) 58.92%, 3,057 votes
Supervisor of Elections
Lori Edwards 77.68%, 78,502 votes
Debbie Hannifan 22.32%, 22,553 votes
School Board, District 1
William Allen 52.38%, 51,489 votes
Billy Townsend 47.62%, 47,298 votes (incumbent)
School Board, District 2
Anita Carson 42.66%, 41,716 votes
Lori Cunningham 57.34%, 56,073 votes
Lake Region Lakes Management District, Seat 2
Steve Enzor 40.90%, 3,701 votes
John C. Lewis 32.05%, 2,900 votes
Robert G. Sheffield 27.04%, 2,447 votes
See Related:"
22,/florida/lakeland/mail-ballot-request-deadline-soon-polk-county-voters,2020-08-06T19:07:45Z,Mail Ballot Request Deadline Is Soon For Polk...,0,0,Skyla Luckey,Patch Staff,"LAKELAND, FL — Polk County voters have until Saturday, August 8, to submit a request for a ballot to be mailed for the statewide primary election that takes place on August 18, the city of Lakeland said in a news release.
Requests for mail ballots can be made online at PolkElections.com/Mail-in-Ballot-Request-Form or by calling 863.534.5888.
""No stamp is necessary to return the ballot as the return postage is prepaid,"" said supervisor of elections, Lori Edwards in a news release.
Mail ballots may be returned by mail or dropped off at the Polk County Supervisor of Elections Office, located at 70 Florida Citrus Blvd., Winter Haven, until 7 p.m., on Election Day. Ballots may also be dropped off at one of the nine early voting sites.
Early voting is open now until August 15, from 10 a.m. to 6 p.m.
You can vote early in-person at nine locations throughout Polk County (click here for map):
For more information, visit PolkElections.com."
23,/florida/lakeland/felony-charges-violent-protesters-part-new-bill-desantis,2020-09-21T19:54:48Z,Felony Charges For Violent Protesters Part Of...,5,13,Skyla Luckey,Patch Staff,"WINTER HAVEN, FL — Legislation that would increase penalties against protesters taking part in violent acts was unveiled on Monday by Gov. Ron DeSantis at a news conference hosted at the Polk County Sheriff's Office. The ACLU of Florida and at least one Democratic lawmaker criticized the bill, which they said aims to provide cover for police brutality and to silence dissent.
Law enforcement leaders from around Florida, including Polk County Sheriff Grady Judd, stood behind DeSantis at the sheriff's office in a show of support for the bill, which is to be introduced in the next legislative session.
The legislation includes felony penalties for protesters involved in looting and other forms of violence, and for those who block roadways while demonstrating.
""You know recently in our country, we have seen attacks on law enforcement,"" DeSantis said. ""We've seen disorder and tumult in many cities across the country. You all have situations where buildings will be in flames and on TV, even though sometimes the news will say it's peaceful, you see the flames behind there, and I think this has been a really, really sad chapter in American history.""
DeSantis said he thought law enforcement from around the state and the Florida National Guard did a great job of responding to protests that spread across the state following the death of George Floyd, who was seen on video struggling to breathe and pleading for help as a Minnesota police officer pressed his knee into Floyd's neck.
""You didn't see the type of disorder here in the state of Florida that you did throughout many parts of the country,"" said DeSantis. ""But I think we need to do more than what we've already done.""
The governor said ""The Combating Violence Disorder and Looting and Law Enforcement Protection Act"" will probably be the boldest piece of legislation to address these issues.
Provision in the law include:
DeSantis said the bill will impose mandatory jail time, keeping people from rejoining protests right away, which he said took place in Portland.
""If you are involved in a violent or disorderly assembly and you harm somebody, and you throw a brick and hit a police officer, you're going to jail with a mandatory jail sentence for at least six months for anyone who strikes a police officer with a weapon or any projectile,"" said DeSantis. ""And we're also not going to simply let people back out onto the streets; so if you are in custody for one of these offenses related to a violent or disorderly assembly, you're not getting bail before your first appearance.""
The ACLU of Florida condemned DeSantis' proposed bill on Facebook.
""Governor Ron DeSantis' proposal is undemocratic and hostile to Americans' shared values,"" the organization said. ""This effort has one goal: silence, criminalize and penalize Floridians who want to see justice for Black lives lost to radicalized violence and brutality at the hands of law enforcement.""
Florida Democratic Rep. Anna Eskamani expressed her disapproval of the bill and those in support of it on Twitter.
""Florida Sheriffs Association & Police Chiefs Association do as they always do — completely ignore racism in policing and instead support increased criminal penalties,"" Eskamani said. ""What a disgrace. If you're a local chief or sheriff that doesn't speak against this proposal, you are complicit."""
24,/florida/lakeland/early-voting-polk-ends-sunday-where-drop-ballots,2020-10-30T16:05:01Z,"Early Voting In Polk Ends Sunday, Where To Drop...",0,0,Skyla Luckey,Patch Staff,"POLK COUNTY, FL — If you plan on being an early voter in this year's general election, Sunday is the last day to vote early in Polk County.
Early voting offices are open from 7 a.m. to 7 p.m. Friday, Saturday and Sunday.
Locations to cast your early ballot in Polk County include:
Mail-In-Voting
Mail-in-ballots must be received at the election headquarters or operations center by 7 p.m. on Election Day. Ballots received in the mail after Nov. 3 will not be counted.
Drop Box Locations
Polk County residents have two convenient locations to drop off their mail-in ballots until the election deadline at 7 p.m. on Nov. 3.
Election Day Voting
If you choose to vote in person on Nov. 3, you can look up your voting precinct online. For your vote to count, you must vote in the precinct in which you reside. Polls are open from 7 a.m. to 7 p.m. on Election Day.
If voting in person, either early or on Nov. 3, voters must bring a current and valid ID with their name, photo and signature. Acceptable IDs include Florida driver's license, a Florida ID card issued by the Department of Highway Safety and Motor Vehicles, a United States passport, a debit or credit card, military ID or a student ID. Find a full list of acceptable IDs here."
25,/florida/lakeland/polk-county-election-results-county-referendum-commission-races,2020-10-27T19:14:34Z,"Polk County Elections: Commission, Referendums...",0,0,Skyla Luckey,Patch Staff,"LAKELAND, FL — Polk County voters have a lot to decide in Tuesday's general election, in addition to filling in that oval circle next to a presidential candidate's name. Other races on the ballot include congressional, state legislative and county commission seats. State constitution amendments and a county referendum are also up for approval.
Early voting closed on Sunday at 7 p.m.
Drop boxes for mail-in ballots are closed in Polk County.
The election headquarters office is allowing voters to drop off their mail-in ballots at its Bartow location, 250 South Broadway Avenue. Mail-in ballots must be received by 7 p.m. on Election Day.
Supervisor of Polk County Elections Lori Edwards is confident that the local polls will remain
organized on Election Day with its 30 full-time employees and 1,700 temporary workers hired for the general election, The Ledger reported.
Polk County Commissioner District 3 candidates are retired Circuit Judge Democrat Bob Doyel, who is challenging incumbent Republican Polk County Commissioner Bill Braswell.
Braswell has received backlash for a recent email he sent out to the community. In the email, he praised the county's efforts and his own for handling federal CARES Act funding that assisted residents and then at the bottom asked for voters to vote for him, The Ledger reported.
Doyel criticized his opponent for his actions.
""The fact that someone running for elected office could use applicants' information for personal or political gain is unbelievable,"" Doyel said reported The Ledger. ""After refusing to issue a mask mandate, for him to take credit for anything related to the pandemic insults the intelligence of the very people who need help.""
Polk County voters will decide whether to extend a property tax exemption that was initially approved in 2012, but is set to expire in 2022 if voters do not approve it again.
Charter Amendment 1: Charter Review
Polk County's Charter Review Commission meets every eight years, and if this amendment passes, it would be every 12 years.
Charter Amendment 2: Efficiency Commission
If this amendment passes, it would reduce expenses to Polk County by abolishing the Polk County Efficiency Commission.
In an effort to ensure every registered voter gets to cast a ballot at the polls, the leaders
of the Democratic Party and Republican Party have recruited 266 poll watchers to keep an eye on things as residents vote.
There will be a team of volunteers monitoring what happens just outside voting sites since state law forbids any campaign activity within 150 feet of the entrance to a polling place.
There are multiple congressional districts listed on the ballot. You will only vote for the
congressional district that represents the district you live in. Find your district representative by viewing your sample ballot from BallotPedia right here.
In Congress District 9, candidates include the incumbent Democrat Darren Soto who is being challenged by newcomer Republican William P. ""Bill"" Olson, a military veteran.
Congress District 15 candidates are newcomers Democrat Alan Cohn and Republican Scott Franklin.
Candidates for Congress District 17 include incumbent Republican Greg Steube who is seeking a second terms and challengers Democrat Allen Ellison and Independent Theodore ""Pink Tie"" Murray.
District 20 State House candidates include former state representative Republican Danny Burgess and newcomer to politics Democrat Kathy Lewis.
""As the former Ex. Dir. of FDVA, I encountered true heroes each & every day,"" Burgess said in a tweet. ""I'm running for the State Senate to be a common sense voice because we are all Americans & there is so much more that unites us than divides us. It's time to rise to meet the mission. I'm ready.""
Lewis has encouraged voters on her social media platforms to get out and vote.
Republican Josie Tomkow is seeking re-election for state representative in District 39, and faces Democrat hopeful Chris Cause. Meanwhile in District 40, newcomers Democrat Jan Barrow, Republican Colleen Burton and Independent Emily Muchie are on the ballot. District 41's incumbent Republican Sam Killebrew faces challenger Democrat Jared West.
The three candidates for District 42 include Republican county commissioner Fred Hawkins, Democrat Barbara Ann Cady and Independent Leroy Sanchez. Incumbent Republican Melony Bell is challenged by Democrat and civil rights leader James Davis in District 56.
Polk County residents will vote on six state amendments:
Florida Amendment 1
Citizen Requirement to Vote in Florida Elections: This amendment provides that only United States Citizens who are at least eighteen years of age, a permanent resident of Florida, and registered to vote, as provided by law, shall be qualified to vote in a Florida election.
Florida Amendment 2
Raising Florida's Mininum Wage: Raises minimum wage to $10 per hour effective September 30, 2021. Each September 30th thereafter, minimum wage shall increase by $1 per hour until the minimum wage reaches $15 per hour on September 30, 2026. From that point forward, future minimum wage increases shall revert to being adjusted annually for inflation starting September 30, 2027.
Florida Amendment 3
All Voters Vote in Primary Elections for State Legislature, Governor, and Cabinet: Allows all registered voters to vote in primaries for state legislature, governor, and cabinet regardless of political party affiliation. All candidates for an office, including party nominated candidates, appear on the same primary ballot. Two highest vote getters advance to general election. If only two candidates qualify, no primary is held and winner is determined in general election. Candidate's party affiliation may appear on ballot as provided by law. Effective January 1, 2024.
Florida Amendment 4
Voter Approval of Constitutional Amendments: Requires all proposed amendments or revisions to the state constitution to be approved by the voters in two elections, instead of one, in order to take effect. The proposal applies the current thresholds for passage to each of the two elections.
Florida Amendment 5
Limitation on Homestead Assessments: Proposing an amendment to the State Constitution, effective date January 1, 2021, to increase, from two years to three years, the period of time during which accrued Save-Our-Homes benefits may be transferred from a prior homestead to a new homestead.
Florida Amendment 6
Ad Valorem Tax Discount for Spouses of Certain Deceased Veterans Who Had Permanent, Combat-Related Disabilities: Provides that the homestead property tax discount for certain veterans with permanent combat-related disabilities carries over to such veteran's surviving spouse who holds legal or beneficial title to, and who permanently resides on, the homestead property, until he or she remarries or sells or otherwise disposes of the property. The discount may be transferred to a new homestead property of the surviving spouse under certain conditions. The amendment takes effect January 1, 2021.
Return to Patch Tuesday night for the latest vote tally. Subscribe to free news alerts for election results.
See related stories:"
