,url,Date,Title,Thank,Reply,author,title,context
0,/california/san-francisco/mayor-london-breed-announces-first-new-affordable-housing-development,2020-05-30T08:00:26Z,Mayor Breed: New Affordable Housing Development,0,0,Press Release Desk,News Partner,"Press release from the Office of the San Francisco Mayor:
May 29, 2020
Maceo May Apartments will be the first 100% affordable project built as part of the Treasure Island redevelopment plan and will feature 104 new homes for homeless and formerly homeless veterans
San Francisco, CA — Mayor London N. Breed today announced the City has taken a major step forward in the development of 104 permanently affordable homes on Treasure Island with the construction finance closing of the Maceo May Apartments. Site work and construction will commence this summer. The redevelopment of Treasure Island will ultimately include 8,000 new homes, over 27% of which will be affordable, 550,000 square feet of retail and commercial space, 300 hotel rooms, and 290 acres of public open space.
""These last few months have shown us how crucial it is to have a safe, affordable place to call home,"" said Mayor Breed. ""It's more important than ever that we keep building high-quality affordable housing and supporting our most vulnerable residents. Making progress on these new homes for veterans is an exciting step in the City's promise create a revitalized Treasure Island and make San Francisco a more affordable place to live for everyone.""
Maceo May Apartments is a 100% affordable, all-electric modular-built housing project and is being developed by Swords to Plowshares (STP), in partnership with Chinatown Community Development Center. Maceo May Apartments will provide 104 permanent supportive housing units for homeless and formerly homeless veterans, including veterans who currently live on Treasure Island. STP is a charter member of One Treasure Island, a non-profit organization committed to fostering an equitable, inclusive, and thriving community that includes formerly homeless and low-income San Franciscans.
""As the first new affordable housing project on Treasure Island, Maceo May is an exciting part of the redevelopment that will provide critical replacement units for current residents, and house additional formerly homeless and low-income veterans,"" said Supervisor Matt Haney. ""The Island is one the most diverse and low-income communities in San Francisco, and it's exciting to see new affordable housing come to life with the incredible partnership of Swords to Plowshares and Chinatown CDC.""
The building is named in recognition of the dedication and advocacy of Maceo May, a Vietnam War veteran who worked at STP for 12 years and subsequently served as a board member for 14 years, until his passing in 2014. Maceo's advocacy played a crucial role in ensuring homeless veterans would be recognized and served on Treasure Island and in the Presidio, and he remains a role model today for his staunch perseverance.
Treasure Island was activated as a United States Naval Base in 1940 and played a substantial role in World War II and the Korean War. In 1993, the Federal Government placed the Treasure Island Naval Station on its Base Realignment and Closure list and it was formally decommissioned in 1997. In 1994, the City began to conduct hearings and community meetings that informed the redevelopment plan that will result in a new San Francisco neighborhood incorporating residents of various socio-economic backgrounds. The Treasure Island Development Authority (TIDA) was also formed in 1997 as a non-profit, public benefit agency dedicated to the economic development of the former Naval Station and the administration of municipal services.
""Local history has been made with the final financing approvals for the Maceo May Apartments,"" said Sherry Williams, Executive Director of One Treasure Island. ""After 25 years of planning, a former military base will now begin its housing development in earnest, with the first affordable project serving homeless and formerly homeless veterans. It is a fitting honor to those who have served and who have struggled with housing and it is a fitting tribute to Maceo May, our first Board President and Swords to Plowshares' tireless Housing Director.""
""This is a tremendous milestone in the process of converting the Naval Station to civilian use, and it was important to everyone involved that this first project acknowledge the service of our nation's veterans,"" said TIDA Director, Bob Beck.
Maceo May Apartments will be completed in 2022 and is made possible by financing support from the Mayor's Office of Housing and Community Development, TIDA, the State of California Veterans Housing and Homelessness Prevention Program, Raymond James, Silicon Valley Bank, and the California Community Reinvestment Corporation. Operating subsidies will be delivered through the City's Department of Homelessness and Supportive Housing Continuum of Care program and the US Department of Housing and Urban Development's Veterans Affairs Supportive Housing program.
""We are thrilled to be moving ahead with Maceo May Supportive Housing for formerly homeless veterans,"" said Michael Blecker, Executive Director of Swords to Plowshares. ""I think Maceo, our first-ever Housing Director and champion for homeless veterans, said it best himself that 'former military bases that were once used to transform young men and women into instruments of war now are used to eliminate their depression, desperation and destitution while beginning to cultivate once buried dignity, dreams and aspirations.' It truly represents the meaning of turning swords into plowshares.""
""Chinatown CDC is proud to be partnering with Swords to Plowshares to build housing for homeless veterans at a time when the cost of our homelessness crisis could not be more clear,"" said Chinatown CDC Executive Director, Malcolm Yeung. ""Starting construction on this critical supportive housing project in the middle of a pandemic and financial crisis is a huge accomplishment that took perseverance from our City and private financing partners. We are thrilled to be carrying out their mandate to build 104 apartments for veterans exiting homelessness.""
Community Driven Partners
Founded in 1994, One Treasure Island's (One TI) charter was to ensure that supportive housing and employment programs for formerly homeless households were an integral component of the reuse plan. Maceo May was One Treasure Island's first Board President. Since 1999 both market rate and formerly homeless households have been living in former Navy housing on an interim basis. Well over 10,000 homeless and low-income San Franciscans have been and continue to be served on Treasure Island in housing, employment and financial services provided by One Treasure Island and its members, including Swords to Plowshares and Chinatown Community Development Center who are codevelopers of Maceo May Apartments. Other One TI members include Catholic Charities, Community Housing Partnership, Mercy Housing California, Health Right360, Rubicon Programs, and Toolworks.
Redeveloping the Island
Treasure Island Community Development (TICD) was selected to be the master developer for Treasure Island in 2003 and played an integral role in shaping the reuse plan that was approved by the Board of Supervisors and then-Mayor Newsom in 2011 along with environmental findings and transaction documents. As the master developer, TICD is responsible for all utilities, site improvements, and other public facilities and infrastructure and will oversee the development of more than 6,000 market rate housing units. TICD's first new residential project on adjacent Yerba Buena Island will be completed in 2021.
This press release was produced by the Office of the San Francisco Mayor. The views expressed here are the author's own."
1,/california/san-francisco/san-francisco-new-health-order-requires-residents-workers-wear-face,2020-05-29T08:04:52Z,San Francisco New Health Order,0,1,Press Release Desk,News Partner,"Press release from the Office of the San Francisco Mayor:
May 28, 2020
Face coverings and social distancing are essential behaviors on the path forward to reopen the City
San Francisco, CA — Mayor London N. Breed and Director of Health Dr. Grant Colfax today announced that everyone in San Francisco will be required to wear face coverings on most occasions when they are outside of their homes, a step that will be critical to the City's ability to safely reopen further. The new rule strengthens the existing face covering Health Order by extending it to more activities.
As the City embarks on the path to recovery, relaxing restrictions on outdoor activities and employment, allowing retail curbside pickup and offering summer camps, there will be more movement of people outside their homes, even with the Stay Home order still in place. Wearing face coverings will be an essential habit to reduce the likelihood of transmitting the virus from person to person.
""As we begin to reopen, it is going to be more important than ever that people cover their faces when they are outside the home,"" said Mayor Breed. ""With more people moving about, we are tempting the virus to spread, and we need to do everything we can to stop that from happening. By covering your face, keeping six feet apart, and washing your hands, you will be helping us continue to make our way out of the crisis and onto the path of better times ahead.""
Face coverings help to stop droplets that may be infectious, even if the person wearing the mask has no or mild symptoms. By strengthening this form of protection, San Franciscans will be better prepared to participate safely in the gradual reopening of activities as we begin to move out of the health emergency.
The requirement is a Health Order by Dr. Tomás Aragón, Health Officer of the City and County of San Francisco. The Order is effective at 11:59 p.m. on May 29, 2020. It is informed by the Centers for Disease Control and Prevention guidelines. Previously, the City recommended face coverings on April 2nd, and then required them on April 17th for all essential businesses and in public facilities, on transit and when performing essential work. Now that requirement is expanded to whenever people are outside their homes in most situations in San Francisco, with very limited exceptions.
""Wearing a mask, or other face covering, is one of the top three things you can do to help us re-open more, and reopen sooner,"" said Dr. Colfax. ""It is also very important to continue to social distancing and to get tested if you have any symptoms. These three actions will help build a community that is safe, healthy and protecting each other from exposure and transmission.""
Wearing a face covering is most effective when combined with physical distancing and hand washing. It is not a substitute for staying home, but it is a way to protect other people and reduce the chance of transmission when outside the house. San Francisco's Stay Home order is still in effect, and residents should continue to stay inside as much as possible.
Face coverings should cover the nose and mouth and fit securely. They can be a manufactured or homemade mask, a bandanna, scarf, towel, neck gaiter or similar item. Cloth face coverings should be cleaned frequently with soap and water.
Masks with one-way valves are not effective because they allow air droplets to freely escape when the wearer exhales. They should not be worn and do not qualify as a face covering under the order. Medical masks – such as isolation masks or N95 masks – are not necessary for the general public. These items are still in short supply and must be reserved for health care workers and first responders.
Compliance with the new rule is not anticipated to be an issue, as the vast majority of San Franciscans have been adhering to the Stay Home Order and social distancing. Many people already are wearing face coverings outside. However, the order does carry the force of law, and noncompliance is a misdemeanor punishable by fine, imprisonment, or both.
Summary of the new requirements – the Health Order and FAQs are posted online.
The exceptions defined in the previous face covering order remain in effect. Here are highlights of what's new:
When face coverings are not required:
This press release was produced by the Office of the San Francisco Mayor. The views expressed here are the author's own."
2,/california/san-francisco/mayor-london-breed-announces-timeline-plan-safely-reopening-san-francisco,2020-05-29T07:58:06Z,Myr Breed: Timeline & Plan Reopening San Francisco,0,1,Press Release Desk,News Partner,"Press release from the Office of the San Francisco Mayor:
May 28, 2020
Plan formulated by the Economic Recovery Task Force allows outdoor dining, indoor retail, and certain outdoor activities to resume on June 15th, assuming they are allowed by the State; additional activities will be permitted to resume with modifications in phases
San Francisco, CA — Mayor London N. Breed today announced a plan for reopening San Francisco that will allow certain businesses and activities to resume with modifications in phases over the coming weeks and months. As long as San Francisco continues to make progress slowing the spread of COVID-19, meets key health indicators, and state guidance continues to allow more activities, San Francisco restaurants will be able to offer outdoor dining, retail businesses will be able to allow customers to shop inside with modifications, and additional outdoor activities can resume on June 15th. The City plans to allow additional activities and businesses to resume in July and August.
""Our residents have a lot to be proud of with how we responded to this pandemic, with many people making enormous sacrifices to protect the health and safety of their fellow residents,"" said Mayor Breed. ""We're entering a new phase of this crisis and we feel comfortable that we're at a place that we can begin reopening parts of our economy, but that is not to say that this virus doesn't continue to threaten our city. As we begin recovering and reopening, all of us are going to have to play our part to adjust to the new normal until we have a vaccine, and we'll continue to do everything we can to offer clear guidelines and precautions to support residents and businesses with the new adjustments that will be needed moving forward.""
San Francisco's reopening plan is aligned with the State's guidelines and is based on a San Francisco-specific risk model to control the spread of COVID-19 and protect public health. The plan is also informed by the work of the San Francisco COVID-19 Economic Recovery Task Force. The timeline for allowing certain businesses and activities to resume will be adjusted as needed based on public health data.
Part of San Francisco's plan for safely reopening includes requiring residents to wear face coverings on most occasions when they leave their home and are near other people, both indoors and outdoors. The public also must comply with other health and safety requirements and recommendations such as social distancing, handwashing, and cleaning frequently touched surfaces. The Department of Public Health will issue a new Health Order today with updated requirements regarding face coverings.
San Francisco's Plan separates the State's second stage into three phases – Phase 2A, 2B, and 2C. San Francisco's Phases 3 are 4 are aligned with the State's stages. San Francisco has already entered into Phase 2A, which allows curbside pickup permitted for most retail, construction, elective surgeries, and outdoor businesses like carwashes, flea markets, and garden stores to operate.
San Francisco's current Stay Home Health Order does not have an expiration date and will be amended over the coming weeks and months to allow for a gradual and safer reopening. Today's plan details the next phases, and provides dates that the City anticipates additional businesses and activities can resume with modifications. The dates in the plan will be finalized through amendments to the Health Order or directives, and will be guided by health indicators. If the City make progress faster than expected, then the timeline outlined below may shift to allow some reopening to occur earlier. For each phase, guidance will be issued to provide businesses and operators with adequate time for planning and compliance with health and safety requirements.
Guidance for personal activities and interactions, such as visiting friends, having play dates and dinner parties is forthcoming. The plan and timeline to reopen businesses and activities was created in coordination with the San Francisco Municipal Transportation Agency's (SFMTA) Transportation Recovery Plan. For each reopening phase, SFMTA will add and adjust services incrementally.
""San Francisco's early and aggressive actions were key to the success we have had fighting the coronavirus,"" said Dr. Grant Colfax, Director of Health. ""As we move to reopen, continuing to prioritize community health will be essential. Every San Franciscan can and must help if we are going to reach better times ahead. That means, covering your face, keeping social distance and getting tested if you have any symptoms. These actions have saved lives and are going to be more important than ever as we start to move around the city again.""
""San Francisco led the way with our public health response and we can lead the way again with a thoughtful and responsible approach to reopening,"" said Assessor Carmen Chu, co-chair of the Economic Recovery Task Force. ""Through the task force, we heard from hundreds of San Franciscans on the need to balance our public health needs with our ability to make ends meet and today's announcement provides a roadmap for all of us to plan and prepare for the future.""
""As we move to reopen, this framework provides business with the information they need to plan their next steps towards recovery,"" said Joaquín Torres, Director of the Office of Economic and Workforce Development. ""And as our communities follow good public health practices, we will see an increase in the activities necessary to move San Francisco towards full economic vibrancy.""
San Francisco Planned Reopening Timeline
The list below does not include all the businesses and activities that the City has included in the plan for reopening. San Francisco will only allow reopening of businesses and activities that are permitted under the State's guidelines. For full information about the City's plan to allow additional activities and business to reopen in phases, go to SF.gov/reopening.
Phase 2A – June 1st
Phase 2B – June 15th
Phase 2C – July 13th
Phase 3 – Mid-August – to be determined, will be more than one sub-phase
Phase 4 – Date to be determined
The Shared Spaces program, which Mayor Breed announced on Tuesday, May 26th, will allow neighborhood businesses to share a portion of the public right-of-way, such as sidewalks, full or partial streets, or other nearby public spaces like parks and plazas for restaurant pick-up and other neighborhood retail activity. Outdoor dining is permitted to resume locally on June 15th, and if the State allows outdoor dining by that time, restaurants will be able to apply for a permit to set up tables and chairs in the public right-of-way.
This press release was produced by the Office of the San Francisco Mayor. The views expressed here are the author's own."
