,url,Date,Title,Thank,Reply,author,title,context
21,/new-jersey/bloomfield/bloomfield-among-nj-towns-seeing-covid-revenue-dip-report,2020-06-24T20:00:03Z,Bloomfield Among NJ Towns Seeing COVID Revenue Dip,0,1,Eric Kiefer,Patch Staff,"BLOOMFIELD, NJ — Bloomfield is among several New Jersey towns struggling with revenue losses amid the coronavirus crisis, and it has the town's mayor ""worried,"" a report says.
Although May property tax payments dropped, the pandemic's overall impact hasn't been as bad in New Jersey as some local officials feared, NJ.com reported.
However, Bloomfield is out $3 million so far, including nearly $1 million from its parking utility and an $800,000 drop (3 percent) in its May property tax collections, Mayor Michael Venezia told NJ.com.
""I'm worried for my community come August or even concerning the November property tax payment,"" Venezia told NJ.com, adding that without assistance, about 5 percent of the town's workforce could be laid off.
COUNCIL APPROVES BUDGET
On Monday, the Bloomfield Township Council adopted a $90 million calendar year 2020 municipal budget and tax resolution, TAP Into Bloomfield reported.
The budget was originally presented at the May 4 council conference meeting and approved at the May 18 regular meeting, TAP Into Bloomfield reported.
Send local news tips and correction requests to eric.kiefer@patch.com
Keep updated with local updates at the Patch Bloomfield Facebook page. Send local news tips and correction requests to eric.kiefer@patch.com"
22,/new-jersey/bloomfield/bloomfield-closes-town-offices-honor-juneteenth,2020-06-19T13:32:38Z,Bloomfield Closes Town Offices To Honor Juneteenth,0,0,Eric Kiefer,Patch Staff,"BLOOMFIELD, NJ — Bloomfield is closing its township offices on Friday, June 19 in honor of Juneteenth.
Juneteenth, which is short for June 19th, is a 155-year-old commemoration that celebrates the emancipation of African Americans from slavery in the United States.
In observation of the day, all municipal offices in Bloomfield will be closed on Friday, town officials said.
Mayor Michael Venezia said his administration and the Township Council are ""constantly looking for ways to make our community a more inclusive environment.""
""It is a crucial step for our township to take to acknowledge this important day in American history,"" Venezia said. ""We would like to use this day to reflect on the past and consider what we can do to make our society more fair and just for all people.""
Send local news tips and correction requests to eric.kiefer@patch.com
Don't forget to visit the Patch Bloomfield Facebook page. Learn more about posting announcements or events to your local Patch site. Sign up for Patch email newsletters."
23,/new-jersey/bloomfield/bloomfield-hold-second-community-conversation-race-0,2020-06-18T16:42:13Z,Bloomfield To Hold Second Conversation On Race,0,0,Press Release Desk,News Partner,"Press release from Bloomfield Township:
June 18, 2020
BLOOMFIELD, NJ -- Mayor Michael Venezia will be hosting the second, in a series of community conversations on race on Wednesday, June 24 at 7:00pm on Zoom.
This second community conversation will focus on public health and healthcare disparities in communities of color and social determinants of health. Councilwoman Jenny Mundell will moderate the webinar and special guest speaker Michellene Davis,Esq., EVP and Chief Corporate Affairs Officer, RWJBarnabas Health, will join the discussion for a presentation.
""Our first community conversation on race went extremely well and proved to be a great way to listen and learn about issues affecting our residents of color. These conversations give us invaluable community input to consider as we continue in our efforts to ensure that everyone in our community is being served,"" said Mayor Michael Venezia. ""We are fortunate to have such a terrific guest speaker in Michellene Davis who was named as one of the Top 25 Most Influential Minority Leaders in Healthcare in the entire nation.""
Please click the link below to join the webinar:
https://us02web.zoom.us/j/82536302214?pwd=SEZ5UjFUTHJYWlF3TGg4ZHUyQlp4Zz09, Password: 148885
Or join by telephone:
1-301-715-8592, Webinar ID: 825 3630 2214, Password: 148885
""Over the past few weeks, Bloomfield has come together for a vigil, peaceful protests, a community conversation on race and policing in Bloomfield, and a chalk the street project,"" said Councilwoman Jenny Mundell. ""However, no conversation about race in our communities is complete without also looking at systemic inequities in healthcare. This issue has been made even more clear in the wake of the COVID-19 pandemic as we've watched this virus disproportionately affect communities of color. The Mayor and the entire Town Council recognize the need for our community to learn more about the systems in place that impact our views of race and lead to racial inequities, as well as the need to work together to ensure a more just and equal society.""
More information about Michellene Davis can be found here. Residents can also read some of her recent work on race and healthcare here.
This press release was produced by the Bloomfield Township>. The views expressed here are the author's own."
24,/new-jersey/bloomfield/bloomfield-department-parks-rec-cultural-affairs-releases-important-update,2020-06-17T16:29:01Z,Bloomfield's Update On Summer Activities,0,0,Press Release Desk,News Partner,"Press release from Bloomfield Township:
June 17, 2020
BLOOMFIELD, NJ -- Due to COVID-19 the Bloomfield Parks, Recreation and Cultural Affairs Department has been forced to make adjustments to planned activities. Following guidance from CDC and state officials, the department has released the following updated information regarding summer activities:
Independence Day Celebration
Bloomfield's annual Independence Day celebration scheduled for Saturday, July 4, at Foley Field has been postponed. The new date is tentatively scheduled for Saturday, September 12. It is the Parks Department's intention to provide entertainment, food, amusements and of course fireworks however, it must adhere to all state and local rules at the time of the scheduled event. More details will be released as it gets closer to the date.
""Throughout the year, we try our best to provide a multitude of fun activities for residents of all ages. Our Parks Department has done a great job putting together weekly drive-in movie nights which will begin tonight, as well as hosting virtual summer fitness classes,"" said Mayor Michael Venezia. ""As a result of COVID-19, we have had to make adjustments to our planned activities in order to comply with CDC and state guidelines and keep everyone safe. With the state slowly beginning to reopen, we hope that we will have more opportunities for recreation in the near future.""
Summer Camps & Sports Clinics
Following Governor Murphy's recent executive order allowing recreational summer camps to begin the second week of July, guidelines and requirements set forth by the Department of Children & Families, CDC and the NJ Department of Health are being reviewed. After review and subsequent discussion with surrounding communities it has been decided that the traditional full day indoor summer camp program will not be possible this summer.
The Parks Department is fully aware that residents need viable options for socialization, recreational play and general child supervision. With this in mind, its staff is working diligently on creating a combination of weekly sports clinics, in person classes and virtual programs during the summer. While full day child care cannot be provided, it is their goal to provide as many opportunities as they can for residents.
These programs are attentively set to begin on Monday, July 6 and run through August 7. Guidelines set forth by the NJ Department of Health and the CDC will be followed to ensure a safe and enjoyable environment for all participants. The goal is to finalize these programs soon and start registration on or about Wednesday, June 24. Please visit the Parks Department website at www.bloomfieldrecreation.org or follow them on Facebook for the most up to date information.
""It is important that Bloomfield families have adequate recreational opportunities in spite of COVID-19. As Liaison to the Parks, Recreation and Cultural Affairs Department, I have worked with them as well as the Mayor to come up with creative ways to keep residents active while following all safety guidelines,"" said Councilwoman Jenny Mundell. ""We will continue to do everything in our power to put on great activities for residents this summer and I look forward to being able to resume normal operations when the crisis is over.""
Summer Concert Series
In light of current conditions and executive orders the traditional Summer Musical Concert Series has been shifted to a Drive-In Movie Series. The Drive-In Movie Series will begin on Tuesday, June 16 and is currently scheduled to run into mid-July. Based on the overwhelmingly positive response the series will likely continue on Tuesday evenings through the end of July.
None of this would be possible without community partners Universal Technical Institute as well as Shelbourne and Bloomfield College for allowing the township to use their parking lots for community events. Pre-registration is required and will open for Bloomfield residents starting each Wednesday at 10:00am via Community Pass registration portal that can be found at www.bloomfieldrecreation.org. Due to social distancing guidelines and safety precautions there will be a limited number of spaces available for each event.
Remaining Shows:
Tuesday, June 23 – Rocky – Bloomfield College – 235 Liberty Street
Tuesday, June 30 – The Lion King – Universal Technical Institute, 1515 Broad Street
Tuesday, July 7 – Lego Batman The Movie – Bloomfield College – 235 Liberty Street
Tuesday, July 14 – Spaceballs – Universal Technical Institute, 1515 Broad Street
Civic Band Concerts
The Bloomfield Civic Band is tentatively scheduled to perform on the Historic Town Green on Monday evenings at 7:00pm on July 6, 13, 20, 27 as long as current executive orders allow.
This press release was produced by the Bloomfield Township>. The views expressed here are the author's own."
25,/new-jersey/bloomfield/bloomfield-public-library-announces-return-limited-services,2020-06-17T16:25:08Z,Bloomfield Public Library Announces Return,0,0,Press Release Desk,News Partner,"Press release from Bloomfield Township:
June 17, 2020
BLOOMFIELD, NJ -- The Bloomfield Public Library is beginning to offer additional services to residents as some COVID-19 restrictions have been lifted by Governor Murphy. The library has begun to accept returns of materials via book drop, with book drops open 24 hours a day. Books from any BCCLS Library may be returned to the library's book drops.
""Our librarians have been working hard throughout the COVID-19 crisis to ensure that residents still have access to the outstanding services that our library provides,"" said Mayor Michael Venezia. ""I am pleased to see that they are now able to start offering additional services which will help us make it through this time indoors. I encourage all Bloomfield residents that have not been taking advantage of all that our library has to offer to do so now.""
The library is asking that residents not return hotspots or museum passes at this time. All due dates for these items have been extended and no fines will be incurred. As a safety precaution all returned items will be quarantined for 72 hours, after which time they will be checked in.
Grab & Go pickup will be available starting June 22. All patrons will be required to wear a mask and keep six feet apart during pickup. Residents will be able to pick up their pre-bagged, pre-checked materials at the main library lobby during the following hours:
Mondays, 1:00pm-3:45pm and 5:00pm-7:30pm
Tuesday-Friday, 10:00am-12:45pm and 2:00pm-4:30pm
Patrons may request materials via BCCLS online catalog, via live chat on the library website at www.bplnj.org, by email to Bloocirc@bccls.org, or by calling the Library at 973-566-6200. Only Bloomfield-owned items will be available and only to Bloomfield Library cardholders.
The library will continue to provide online services, including eBooks, live chat, databases, virtual programs for children and adults and will soon be launching a summer reading program.
This press release was produced by the Bloomfield Township>. The views expressed here are the author's own."
26,/new-jersey/bloomfield/bloomfield-municipal-clerk-releases-critical-information-july-primary-election,2020-06-15T17:30:52Z,Bloomfield July Primary Election Information,0,0,Press Release Desk,News Partner,"Press release from Bloomfield Township:
June 12, 2020
BLOOMFIELD, NJ -- With the deadline to register to vote for the July 7 primary election quickly approaching, Bloomfield Municipal Clerk Louise Palagano is releasing important voting information to residents.
The deadline to register to vote, update a signature or change your address/party affiliation for the primary election is this Tuesday, June 16. The Municipal Clerk's office will be open from 8:30am-4:30pm on Monday and from 8:30am-9:00pm on Tuesday if any resident has questions or would like to submit a registration.
Face masks must be worn by anyone entering the Municipal Building. Additionally, all visitors will be scanned by a thermal scanner prior to entering the building which the township recently purchased to keep residents and township employees safe.
""The right of all Bloomfield residents to have their voices heard in this primary election is extremely important to us,"" said Mayor Michael Venezia. ""If you are not registered to vote and would like to take part in the primary election process, please get your registration into the Clerk or in the mail to be postmarked by Tuesday.""
All voting for this election will be done by mail. All registered Democrats and Republicans will receive a ballot in the mail that must be returned no later than July 7. You may only vote in the Democratic or Republican primary if you are registered to one of those parties. No postage is required.
""Our office along with the Mayor and Town Council have prioritized getting information about this primary election out to our residents,"" said Municipal Clerk Louise Palagano. ""We want to ensure that everyone understands how this unique election will be taking place to avoid confusion and allow everyone to vote. Please do not hesitate to reach out to our office if you have any questions or concerns about voting in this election.""
Mayor Venezia hosted a virtual voter information session with County Clerk Chris Durkin and Municipal Clerk Louise Palagano on Wednesday, June 10. The session served to educate residents of changes to the voting process as a result of COVID-19.
Residents with questions about the upcoming election can email the Clerk's Office at twpclerk@bloomfieldtwpnj.com or call 973-680-4015.
This press release was produced by the Bloomfield Township>. The views expressed here are the author's own."
27,/new-jersey/bloomfield/bloomfields-lackawanna-transit-station-improvement-project-meeting-scheduled,2020-06-11T16:32:19Z,Lackawanna Transit Project Meeting Scheduled,0,0,Press Release Desk,News Partner,"Press release from Bloomfield Township:
June 10, 2020
BLOOMFIELD, NJ –The first public meeting to discuss the plans to improve the Lackawanna Transit Station and Wayfinding signage around town has been set for Wednesday, June 24, 2020 from 7:00pm to 8:30pm and all Bloomfield residents are invited to participate.
Staff members from Bloomfield Township's planning and engineering departments, along with consultants from CME Associates and Stokes Creative Group, Inc., will conduct this online public information center meeting to inform the public about the project and solicit input. This meeting follows a well-attended stakeholder meeting in early March.
The proposed Lackawanna Transit Station Improvement Project will provide improvements to the Historic Lackawanna Transit Station and twelve surrounding roadway intersections within Bloomfield Center District. This project will enhance New Jersey's travel and tourism efforts by increasing ridership at the Lackawanna Station, boosting the surrounding business district and aiding Bloomfield's downtown area stability. Additionally, the proposed improvements will serve locals and visitors with new signage to navigate downtown Bloomfield by walking or biking to a from key points of interest, improve accessibility within Bloomfield Center, as well as navigate motorist to parking facilities. The project will also add much needed streetscape to the area fronting Lackawanna Station. Many residents, shoppers and commuters will enjoy the proposed new walkways, curbs, pavement repairs at the train station and new signage along the wayfinding routes, as well as promote alternative modes of transportation.
During this online public meeting, there will be a presentation to review the proposed improvements and signage. The public is invited and encouraged to participate via phone, tablet or computer in this upcoming public meeting to provide valued feedback regarding the future improvements mentioned above. Participants will have an opportunity to review the proposed project, ask questions and discuss your thoughts with multiple representatives from the team. Following the meeting, the presentation and comment forms will be available through the Bloomfield Township website.
To join the meeting, please visit https://bit.ly/bloomfieldTAP or You can also dial in using any phone by calling (646) 749-3112. The access code is 557-841-269.
FLYER HERE
This press release was produced by the Bloomfield Township>. The views expressed here are the author's own."
28,/new-jersey/bloomfield/sen-ronald-rice-george-floyd-love-what-will-change-us,2020-06-09T15:34:47Z,Sen. Rice On Floyd: ‘Love Is What Will Change Us',1,1,Eric Kiefer,Patch Staff,"ESSEX COUNTY, NJ — A state senator from Essex County has a message for his community as it continues to grapple with the national debate over police brutality: ""America has the capacity to change – because it has us.""
Recently, Sen. Ronald Rice of the 28th District released a statement about George Floyd's death.
Floyd's funeral takes place Tuesday in Houston, Texas. The public paid its respects Monday; the June 9 memorial service will be limited to Floyd's family and friends due to social distancing guidelines.
Rice, who represents the 28th District (Bloomfield, Glen Ridge, Irvington, Newark and Nutley), served on the Newark Police Department for eight years before entering politics. He holds a master's degree in criminal justice from Rutgers University, and is the chair of the New Jersey Legislative Black Caucus.
The senator's full statement follows below.
""None of us knows when our final day will come, but we can only hope that when it does, it won't be the result of being killed by an unfounded hate born of an unfounded fear that we are somehow dangerous just by being who we were created to be.
""I've lived 75 years as an African American. I spent my earliest years in the segregated South. I've served as a Marine in Vietnam and as a cop, councilman and deputy mayor in Newark. I've been a State Senator for 34 years. I am a son and brother. I am a husband and father. I am a grandfather. I am first and foremost a human being, flawed and imperfect, with my own fears to contend with.
""Today, I reflect on all the things that I am, and all the things I've seen. I do it in honor of George Floyd, in profound grief for him and thousands of others who have been killed by racism. I come to a full stop to honor George Floyd by putting every ounce of my concentration into how America can, once and for all, finally, put our knees on the neck of racism and smother the fear that fuels it.
""What I come to, is that we must – every one of us – sit in silence for a moment and picture our friends. See the faces of those we share laughs and life with. Picture lunchtime at work or school. Think about those we worship with. Consider the faces of people we relate best to in all the parts of our lives – at the gym or the park, on the bus or the elevator.
""If everyone in your sphere looks like you, you have discovered the first thing that needs to change. We can't treat others like ourselves unless we see ourselves in them. And we can't do that until we know them.
""Knowing brings understanding, and understanding brings love.
""We must start with invitations for inclusion. In the name of George Floyd and his family, I beg you to reach out to someone today who does not look like you. Walk over to them and start a conversation. Pick up the phone. Take the first step toward expanding your friends group.
""Do it again tomorrow. And the next day. And every day.
""It is not enough to forward a meme or to like a post, or to feel pity or sympathy for George Floyd and all the others who've been murdered. We must live a life of inclusion. We must open our hearts to each other and feel true empathy that results in the kind of tender compassion our nation needs so desperately.
""Legislation and policies and programs go a long way toward equality and justice but they can't take the place of love. Love is what will change us. And it has to start in my heart and yours.
""America has the capacity to change. Because it has us.""
Send local news tips and correction requests to eric.kiefer@patch.com
Learn more about posting announcements or events to your local Patch site. Sign up for Patch email newsletters."
29,/new-jersey/bloomfield/exercise-your-constitutional-right-vote-bloomfield-workshop,2020-06-08T21:08:03Z,Bloomfield To Hold Voting Info Event Online,0,0,Eric Kiefer,Patch Staff,"BLOOMFIELD, NJ — As a result of the coronavirus, the New Jersey primary election in July will be conducted almost entirely by mail. But what does that mean for Bloomfield residents?
According to a municipal news release, Mayor Michael Venezia, Municipal Clerk Louise Palagano and Essex County Clerk Chris Durkin will hold a virtual voter information session on Wednesday, June 10 at 5 p.m. in an effort to ""prevent any confusion and educate residents about the July primary.""
To take part in the event, visit https://us02web.zoom.us/j/82267338255?pwd=Y3QzWUhVREpNQU1QOEcxMGU1cXM4QT09 and enter the password 036443 or call in to 1301-715-8592 and enter the Webinar ID 822 6733 8255 and password 036443.
""It's the priority of our township to ensure that every resident is able to exercise their constitutional right to vote in this upcoming primary election,"" Venezia said. ""We will have multiple polling stations open in case a resident has an issue that arises while trying to vote though because of COVID-19 we encourage residents to vote by mail if they can.""
According to Bloomfield officials:
Bloomfield officials continued:
Send local news tips and correction requests to eric.kiefer@patch.com
Don't forget to visit the Patch Bloomfield Facebook page. Learn more about posting announcements or events to your local Patch site. Sign up for Patch email newsletters."
30,/new-jersey/bloomfield/bloomfield-mayor-venezia-essex-county-clerk-durkin-hold-virtual-voter-info,2020-06-08T18:13:45Z,Bloomfield's Virtual Voter Information Session,0,0,Press Release Desk,News Partner,"Press release from Bloomfield Township:
June 8, 2020
BLOOMFIELD, NJ -- In order to prevent any confusion and educate residents about the July primary, Mayor Michael Venezia, Municipal Clerk Louise Palagano and County Clerk Chris Durkin will be holding a virtual voter information session on Wednesday, June 10 at 5:00pm. As a result of COVID-19, the July New Jersey primary will be conducted almost entirely by mail.
""It is the priority of our township to ensure that every resident is able to exercise their constitutional right to vote in this upcoming primary election,"" said Mayor Michael Venezia. ""We will have multiple polling stations open in case a resident has an issue that arises while trying to vote though because of COVID-19 we encourage residents to vote by mail if they can.""
To take part in the event, go to https://us02web.zoom.us/j/82267338255?pwd=Y3QzWUhVREpNQU1QOEcxMGU1cXM4QT09 and enter the password 036443 or call in to 1301-715-8592 and enter the Webinar ID 822 6733 8255 and password 036443.
All active registered Democratic and Republican voters will be receiving a mail-in ballot prior to the primary election that must be returned no later than July 7. The ballot must be filled out and signed however, no postage is required. Vote by mail applications will be sent to all active voters that are registered as unaffiliated and all inactive voters registered as Democrat and Republican.
If you are not registered to vote and wish to take part in the July election, you must register by Tuesday, June 16. If a resident does not receive a vote by mail ballot or cannot vote by mail due to a disability, they may do so provisionally.
The Municipal Clerk's office will be open from 8:30am to 9:00pm on June 16 (registration deadline) to anyone that would like to register to vote. The Clerk's office is located in the Bloomfield Municipal Building in room 214.
Contact the Bloomfield Municipal Clerk's Office for a voter registration form or to change your address by calling 973-680-4191 or emailing twpclerk@bloomfieldtwpnj.com. Leave a message with your name and address and a form will be mailed to you.
This press release was produced by the Bloomfield Township>. The views expressed here are the author's own."
