,url,Date,Title,Thank,Reply,author,title,context
42,/new-jersey/bloomfield/bloomfield-launches-six-month-angled-parking-pilot-study,2020-07-09T16:24:49Z,Bloomfield Launches Six Month Angled Parking...,0,0,Press Release Desk,News Partner,"Press release from Bloomfield Township:
July 9, 2020
BLOOMFIELD, NJ -- In an effort to make parking safer and increase the number of available spots, the township has begun an angled parking pilot study. The study will last for six months and if successful, the angled spots will become permanent.
""We are always searching for better ways to provide parking, especially in our main shopping area,"" said Mayor Michael Venezia. ""We have seen in other communities that reverse angle parking provides a safer way to access a vehicle and exit a parking spot. One of the most important features that I saw with this new way of parking is that it's easier and safer for parents with little children.""
The parking method takes some practice and we will be assisting our residents with getting in and out of those spots,"" said Township Administrator Mathew Watkins. ""We will have a parking attendant at the location to assist and we have erected new signs with the hope that the benefit will pay off after the trial period.""
In this video, Bloomfield Police Lieutenant Naomi Zepeda demonstrates how to properly pull into the new angled spots. Drivers must pull in front of the spot they wish to park in, put their blinker on to indicate they are going to park and then carefully back into the parking space.
In a township traffic study conducted by traffic engineers, it was determined that by adding angled parking to this area, it would increase safety and open up additional parking spots. With this method of parking, car doors would no longer open towards traffic and getting out of a space will be much easier because the driver would be facing oncoming traffic. If the trial period proves successful, the township will look to expand this type of parking into other areas.
This press release was produced by the Bloomfield Township>. The views expressed here are the author's own."
43,/new-jersey/bloomfield/bloomfield-council-primary-election-results-dems-run-unopposed,2020-07-08T00:00:00Z,Bloomfield Town Council Primary Election Results,0,0,Eric Kiefer,Patch Staff,"BLOOMFIELD, NJ — Three candidates ran unopposed for the Democratic Party nomination in the Bloomfield Township Council race during the 2020 primary election on Tuesday.
Jenny Mundell (Ward 1), Nicholas Joanow (Ward 2) and Sarah Cruz (Ward 3), each ran unopposed for the Democratic nomination in their respective wards.
Pending official results from the Essex County Clerk's Office, the three candidates – Mundell, Joanow and Cruz – will represent the Democratic Party in the general election on Tuesday, Nov. 3.
No Republicans appeared on the ballot in Bloomfield.
Due to the coronavirus crisis, most voting took place by mail. All active, registered Democrats and Republicans were automatically mailed ballots. Ballots must be returned with a postmark on or before July 7, and must be received by the county board of elections by 8 p.m. on July 14 to be counted. A limited number of polling places were also open Tuesday for provisional ballots. (Learn more here)
Send local news tips and correction requests to eric.kiefer@patch.com
Don't forget to visit the Patch Bloomfield Facebook page. Learn more about posting announcements or events to your local Patch site. Sign up for Patch email newsletters."
44,/new-jersey/bloomfield/bloomfield-hold-free-shredding-events-august-1-november-7,2020-07-07T17:13:26Z,Bloomfield To Hold Free Shredding Events,0,0,Press Release Desk,News Partner,"Press release from Bloomfield Township:
July 7, 2020
BLOOMFIELD, NJ -- The township will be holding two free shredding events over the next several months on August 1 and November 7 at Pulaski Park. Pulaski Park is located at 24 Mt. Vernon Ave. and both events will take place between 9:00am and 12:00pm rain or shine.
""We try to provide as many services to residents as we possibly can to ensure that they get value for their tax dollars,"" said Mayor Venezia. ""These events are always well attended and we have received positive feedback since we began doing this. If you are a Bloomfield resident, you should take advantage of these opportunities. I simply ask that when you come to these events that you wear a mask to protect yourself and our staff.""
Shredding events are only open to Bloomfield residents who must provide proof of residency. The events are not for commercial purposes and masks will be required.
This press release was produced by the Bloomfield Township>. The views expressed here are the author's own."
45,/new-jersey/bloomfield/bloomfield-s-beautification-committee-announce-town-wide-cleanup,2020-10-05T17:20:25Z,Bloomfield’s Beautification Committee Announce...,0,0,Press Release Desk,News Partner,"Press release from Bloomfield Township:
Oct. 5, 2020
BLOOMFIELD, NJ -- The township is continuing to take a proactive approach to keep Bloomfield beautiful, environmentally friendly and sustainable. Mayor Venezia and the Town Council in partnership with the Bloomfield Beautification Committee have announced a town-wide cleanup on Saturday, October 24.
""Bloomfield is a beautiful place to live and we want to ensure that it remains that way,"" said Mayor Venezia. ""In order to do that, we must continue to take steps to keep our neighborhoods clean and work towards a more sustainable community. I hope to see all residents that are able to, out with us on the 24th and I encourage all residents to take our Green Challenge pledge.""
The Green Challenge pledge is a commitment to keep Bloomfield environmentally friendly and sustainable. The township needs 2,500 participants in order to have the effort count toward its Sustainable New Jersey certification renewal. Bloomfield residents who are 18 and over can participate by going to https://tinyurl.com/BloomfieldGreenChallenge.
""It is so satisfying to see our community come together in our efforts to clean up our neighborhoods every year,"" said Councilwoman Jenny Mundell. ""The people of Bloomfield care about our community and want to see it continue to be an outstanding and beautiful place to live, work and visit. I look forward to getting out there with residents and identifying parts of town that might need a little more attention.""
To participate in the town-wide cleanup, sign up at http://bit.ly/BloomfieldCleanup by October 16. Residents may choose a location in their neighborhood in which they would like to ""beautify."" The Bloomfield DPW will provide all materials at the location you designate, including gloves, masks, garbage pickers, bags, and more and will pick up materials, filled bags, and debris. Please adhere to masks and social distancing recommendations.
This press release was produced by the Bloomfield Township. The views expressed here are the author's own."
46,/new-jersey/bloomfield/heres-where-voters-can-find-ballot-drop-box-bloomfield,2020-09-15T19:08:40Z,Here's Where Voters Can Find A Ballot Drop Box...,1,1,Eric Kiefer,Patch Staff,"BLOOMFIELD, NJ — Bloomfield residents who are concerned about the security of their mail-in ballots may find some solace via a local ""drop box"" that has been put up for the 2020 general election.
Recently, the Essex County Clerk's Office released a list of secure ballot box locations for the upcoming election in November. In Bloomfield, a drop box will be located at Firehouse #3, at 124 East Passaic Avenue. (See the full list below)
While limited polling places will be open on Nov. 3, the election is taking place mostly via mail in New Jersey due to the coronavirus pandemic. See sample ballots in Essex County here.
The full list of drop boxes in Essex County follows below.

Send local news tips and correction requests to eric.kiefer@patch.com
Don't forget to visit the Patch Bloomfield Facebook page. Learn more about posting announcements or events to your local Patch site. Sign up for Patch email newsletters."
47,/new-jersey/bloomfield/bloomfields-covid-19-testing-take-place-beginning-september-19,2020-09-11T17:53:50Z,Bloomfield's COVID-19 Testing To Take Place...,0,0,Press Release Desk,News Partner,"Press release from Bloomfield Township:
Sept. 11, 2020
BLOOMFIELD, NJ -- Mayor Venezia and the Township Council have announced additional COVID-19 testing dates for Bloomfield residents. Testing will take place on Saturday's beginning September 19 and will occur in the municipal parking lot.
""The Township Council and I are doing everything in our power to keep residents safe and ensure that anyone that would like to be tested can be tested,"" said Mayor Michael Venezia. ""We have been holding free testing events like these since June and will continue to do so as long as there is a demand. If you are exhibiting any possible COVID-19 symptoms, please consider making an appointment so that you can be tested.""
On September 19, testing will take place from 10:00am-2:00pm in the municipal parking lot located at 1 Municipal Plaza. Any resident that wishes to be tested must first make an appointment by calling the Bloomfield Health Department at 973-680-4057.
Testing will be conducted on a first come first serve basis. Future testing sites and times will be shared with the public at a later date.
This press release was produced by the Bloomfield Township. The views expressed here are the author's own."
48,/new-jersey/bloomfield/bloomfield-public-library-resume-fax-scanning-photocopying-services-sept-8,2020-09-04T16:36:43Z,"Bloomfield Public Library To Resume Fax,...",0,0,Press Release Desk,News Partner,"Press release from Bloomfield Township:
Sept. 4, 2020
BLOOMFIELD, NJ -- The Bloomfield Public Library will once again be offering fax, scanning and photocopying services beginning this Tuesday. These services had temporarily suspended as a result of COVID-19.
""Throughout the COVID-19 crisis, all of our departments have made it a priority to continue delivering as many services as possible for residents,"" said Mayor Venezia. ""For safety reasons, some services have been scaled back and others have been temporarily put on hold. I am thrilled to see the Library open up these services once again in addition to the exceptional services they have been providing.""
The library is currently offering front door pickup of requested library materials such as books and DVD's in addition to print jobs which have been emailed to the reference department's email at reference@bplnj.org. Documents for faxing, scanning, or photocopying should be dropped off at the Adult Library's front door with instructions as to the handling of the material. A staff member will return the completed job to the patron who will remain outside the building.
There is no charge for service costing less than $1.00. Payment for services costing $1.00 and over must be paid for with either a credit or debit card.
The Bloomfield Library's hours are Monday 1:00pm-3:45pm & 5:00pm-7:30pm and Tuesday-Friday 10:00am-12:45pm & 2:00pm-4:30pm. The Library will be open on Saturdays for front door service after Labor Day. Hours will be the same as the Tuesday-Friday schedule.
All patrons must wear a mask and maintain social distancing (6') from staff and other patrons while waiting for their service to be completed. To contact the library call 973-566-6200, email reference@bplnj.org, or use Purechat available on the library's web site at www.bplnj.org.
This press release was produced by the Bloomfield Township. The views expressed here are the author's own."
49,/new-jersey/bloomfield/bloomfield-public-library-receives-5k-incubation-grant-nj-council-humanities,2020-09-04T16:34:27Z,Bloomfield Public Library Receives $5K...,0,0,Press Release Desk,News Partner,"Press release from Bloomfield Township:
Sept. 4, 2020
BLOOMFIELD, NJ -- The Bloomfield Public Library has received $5,000 in grant money from the NJ Council for the Humanities. The money will be used to fund events that will encourage Bloomfield residents to vote, learn information about local elections and learn why it is important to be involved in local government.
""Our municipal government is always searching for opportunities to bring in grant money to improve and expand upon services we offer residents at no cost to our taxpayers,"" said Mayor Venezia. ""This money will go to an admirable cause and will hopefully increase civic engagement in Bloomfield. Local government often gets overlooked but is what impacts our lives the most on a daily basis therefore residents should know about it.""
All events will be streamed via Zoom for free. A schedule for these events will be shared when one is available.
""This grant money will be put to excellent use by our Library in order to increase civic engagement among our residents,"" said Councilwoman and Liaison to the Bloomfield Public Library Jenny Mundell. ""An understanding of how government operates at all levels is essential to our democracy. I look forward to the informative events that the Library staff will put together with this funding.""
The following events will be taking place as part of the grant program:
● Who Really Elects the President: The Workings of the Electoral College: Frank
Argote-Freyre, an Associate Professor at Kean University and 2012 elector for President Barack Obama will explain the Electoral College process.
● What's All This About ""Fake News""?: Jason Luther, an Assistant Professor at Rowan
University at Rowan University will explain why ""fake news"" spreads so easily, how to
identify truth from fact, and how we can overcome it.
● Everything You Need to Know About Voting in 2020: Essex County Freeholder Carlos
Pomares and Essex County Clerk Christopher Durkin will discuss vote-by-mail and
answer all the questions that residents have about how voting is different in 2020.
● How Local Elected Officials Work Together: A discussion featuring elected officials at
state, county, and town level about what their roles are and how they work together.
This press release was produced by the Bloomfield Township. The views expressed here are the author's own."
50,/new-jersey/bloomfield/bloomfield-library-awarded-funds-promote-voting-elections,2020-09-04T16:28:32Z,Bloomfield Library Awarded Funds To Promote...,0,0,Eric Kiefer,Patch Staff,"BLOOMFIELD, NJ — The Bloomfield Public Library recently received $5,000 in grant money from the New Jersey Council for the Humanities.
According to town officials, the money will be used to fund events that will encourage Bloomfield residents to vote, learn information about local elections and learn why it is important to be involved in local government.
""Our municipal government is always searching for opportunities to bring in grant money to improve and expand upon services we offer residents at no cost to our taxpayers,"" Mayor Michael Venezia said.
""Local government often gets overlooked but is what impacts our lives the most on a daily basis, therefore residents should know about it,"" Venezia said.
All events will be streamed via Zoom for free. A schedule for these events will be shared when one is available, town officials said in a news release.
""This grant money will be put to excellent use by our Library in order to increase civic engagement among our residents,"" Councilwoman Jenny Mundell said.
""An understanding of how government operates at all levels is essential to our democracy,"" added Mundell, liaison to the Bloomfield Public Library. ""I look forward to the informative events that the library staff will put together with this funding.""
The following events will be taking place as part of the grant program:
Send local news tips and correction requests to eric.kiefer@patch.com
Don't forget to visit the Patch Bloomfield Facebook page. Learn more about posting announcements or events to your local Patch site. Sign up for Patch email newsletters."
51,/new-jersey/bloomfield/bloomfield-fire-department-takes-part-implicit-bias-training,2020-09-01T17:09:52Z,Bloomfield Fire Department Takes Part In...,0,0,Press Release Desk,News Partner,"Press release from Bloomfield Township:
Sept. 1, 2020
BLOOMFIELD, NJ -- Over the course of the last four shifts, Bloomfield Firefighters have each taken part in a 90 minute interactive workshop on implicit bias. The goal of the workshop is to identify their role and responsibility in understanding, addressing and dismantling implicit bias.
""It is imperative that all of our municipal employees that work with the public on a regular basis have the training necessary to do so,"" said Mayor Michael Venezia. ""Implicit bias training will help to prevent possible negative interactions with residents regardless of the color of their skin. I am proud of the proactive steps that we have taken to ensure that all residents are treated fairly and equally including our community discussions on race.""
Diversity Consultant Dr. David Jones was the guest speaker and trainer for the workshop. The sessions focused on:
""As first responders, our Firefighters work with residents on a day to day basis. It is crucial that we recognize the unconscious potential for biased behavior in the community as well as in our own workplace,"" said Fire Chief Louis Venezia. ""This workshop further demonstrates our commitment to constantly evolving in order to best serve the residents of Bloomfield.""
This press release was produced by the Bloomfield Township. The views expressed here are the author's own."
52,/new-jersey/bloomfield/bloomfield-cycle-one-water-bills-be-sent-out-week,2020-08-28T16:23:53Z,Bloomfield Cycle One Water Bills To Be Sent Out...,0,0,Press Release Desk,News Partner,"Press release from Bloomfield Township:
Aug. 28, 2020
BLOOMFIELD, NJ -- Bloomfield residents will be receiving their cycle one water bills in the mail within the next few days. As a result of COVID-19, the cycle one bill will cover a longer billing period than usual which will explain the higher bill that some residents will get.
""As a result of COVID-19, we have been forced to adapt and make changes in order to keep residents and municipal employees safe and healthy,"" said Township Administrator Matthew Watkins. ""One of the changes you will notice is that we have extended the billing period for the cycle one water bill. Residents may notice a higher bill but it is only due to the longer than usual billing period. Should you have any questions or concerns, please feel free to contact the Water Department at 973-680-4051.""
The bill will cover the timeframe of March 31 - August 25 and will be due September 25. Bills can be submitted online or in person at the Municipal Building between 8:30am and 4:30pm.
This press release was produced by the Bloomfield Township. The views expressed here are the author's own."
53,/new-jersey/bloomfield/bloomfield-tweaks-water-billing-cycle-due-coronavirus,2020-08-28T13:38:07Z,Bloomfield Tweaks Water Billing Cycle Due To...,0,0,Eric Kiefer,Patch Staff,"BLOOMFIELD, NJ — Bloomfield had to temporarily tweak the way it bills residents for water because of the coronavirus, officials say.
According to a municipal news release, Bloomfield residents will be receiving their cycle one water bills in the mail within the next few days. As a result of COVID-19, the cycle one bill will cover a longer billing period than usual which will explain the higher bill that some residents will get.
""As a result of COVID-19, we have been forced to adapt and make changes in order to keep residents and municipal employees safe and healthy,"" Township Administrator Matthew Watkins said.
""One of the changes you will notice is that we have extended the billing period for the cycle one water bill,"" Watkins explained. ""Residents may notice a higher bill but it is only due to the longer than usual billing period. Should you have any questions or concerns, please feel free to contact the Water Department at 973-680-4051.""
The bill will cover the timeframe of March 31 to Aug. 25, and will be due Sept. 25. Bills can be submitted online or in person at the Municipal Building between 8:30 a.m. and 4:30 p.m.
Send local news tips and correction requests to eric.kiefer@patch.com
Don't forget to visit the Patch Bloomfield Facebook page. Learn more about posting announcements or events to your local Patch site. Sign up for Patch email newsletters."
54,/new-jersey/bloomfield/bloomfield-hold-next-community-conversation-race-wednesday-sept-2,2020-08-27T18:10:58Z,Bloomfield To Hold Next Community Conversation...,0,0,Press Release Desk,News Partner,"Press release from Bloomfield Township:
Aug. 27, 2020
BLOOMFIELD, NJ -- The township will hold an additional community conversation on race next Wednesday at 7:00pm via Zoom following last month's conversation which focused on the social construction of race and its real life implications.
Associate Professor for the Sociology Department at William Paterson University Wendy Christensen, Director of Diversity and Inclusion at Clara Maass Medical Center Desyra Highsmith Holcomb and Co-Chair/Director of Equity and Education for the Visions and Dreams Foundation Joseph Graham Jr will be the guest speakers. Councilwomen Dr. Wartyna Davis and Jenny Mundell will moderate the conversation.
""Each community conversation on race has gotten us closer to our goal of understanding the issues affecting our residents of color and what we can do to improve,"" said Mayor Venezia. ""We will continue to have these community meetings as long as they continue to be productive and informative. I encourage all members of the community to join us on Wednesday.""
To join the Zoom meeting go to: https://us02web.zoom.us/j/86090982309?pwd=ZEpwdlNuZENGTHJuZCsweXBsVUtCQT09
and enter Meeting ID: 860 9098 2309 Passcode: 090007 or call 1 646 558 8656 and enter Meeting ID: 860 9098 2309 Passcode: 090007.
During the first part of the conversation on September 2, participants will be invited to share their commitments and experiences. This will be followed by a conversation led by the guest speakers, exploring bias and inequality in various spheres of our life (work, schools, housing, healthcare, etc.) and will wrap up with suggestions for further exploration and action.
This is a follow up community conversation building on the July 29 event, ""Let's Talk About Race"" with Dr. Christensen and Ms. Highsmith-Holcomb, during which community members were invited to commit to participating in an anti-racist, anti-biased activity or engage with one of the community conversation resources here: https://www.bloomfieldtwpnj.com/1538/6971/Community-Conversation-Resource-Links?activeLiveTab=widgets
Participation in the previous meeting is not required to attend this meeting. The July 29 conversation, ""Let's Talk About Race,"" can be viewed here: https://www.facebook.com/watch/?v=366969620936415&extid=WyCfCD1Jq5K3dT36
Wendy M. Christensen is an Associate Professor in the Sociology Department at William Paterson University in New Jersey. Originally from Maine, she received her Ph.D. from the University of Wisconsin–Madison in 2010. Her research focuses on how political discourse and participation is shaped by social inequalities. Her book, ""Mothers of the Military: Support and Politics During Wartime,"" was published by Rowman & Littlefield Press (2018). At WPUNJ she teaches courses on social movements, social inequality, theory, war and media. She is active in efforts on campus to empower students to political activism, and involved in local community organizing and social movements.
Desyra Highsmith Holcomb is the Director of Diversity and Inclusion at Clara Maass Medical Center in Belleville, New Jersey an affiliate of RWJBarnabas Health, where she pursues an inclusive and compassionate culture for patients, employees and the community. Highsmith Holcomb previously worked at William Paterson University where she held various roles. She helped develop and execute initiatives which advanced the culture of that University and recruited a diverse staff. Additionally in her time there she led efforts to increase awareness for issues having to do with discrimination, equal opportunity, diversity and inclusion.
Joseph Graham, Jr. is the Co-Chair/Director of Equity and Education for the Visions and Dreams Foundation. He has been a leader in Equity, Diversity and Inclusion work for over 25 years. He is instrumental in providing Equity, Diversity & Inclusion support to counties in the areas of K12 education, Higher education, Criminal Justice, Corporations, Healthcare, Social service agencies, Nonprofit organizations and others. Joseph Graham Jr. specializes in identifying inequities and providing Professional Development, workshops, short-term and long term plans as a part of tailor-made strategies and methods to accomplish the designated goals.
This press release was produced by the Bloomfield Township. The views expressed here are the author's own."
