,url,Date,Title,Thank,Reply,author,title,context
30,/california/san-francisco/mayor-london-breed-announces-flexible-housing-subsidy-pool-transition,2020-07-10T08:02:48Z,Mayor London Breed Announces The Flexible...,0,0,Press Release Desk,News Partner,"Press release from the Office of the San Francisco Mayor:
July 09, 2020
As the City pivots from COVID-19 response to recovery, the City partners with non-profits to fund and operate a bold initiative to ensure that hundreds of unhoused residents never return to homelessness
San Francisco, CA — Today, Mayor London N. Breed and the All In Campaign, powered by Tipping Point Community, announced that 200 unhoused San Franciscans who have been temporarily placed in hotels under the City's emergency response to COVID-19 would move into long-term homes by the end of the year through a Flexible Housing Subsidy Pool.
""Even as we have implemented emergency responses to COVID-19, we have remained focused on long term solutions to homelessness, particularly more housing,"" said Mayor Breed. ""The Flexible Housing Subsidy Pool is an innovative and cost-effective way to get our unhoused residents out of temporary shelters, off the streets, and into permanent homes.""
The ""Flex Pool,"" as it is commonly known, is a housing strategy that matches people experiencing homelessness to vacant private market apartments across the city, and provides supportive services so that they remain stably housed. This model has proven effective, helping over 8,000 people transition from homelessness to permanent homes with supportive services in Los Angeles since 2014. San Francisco has already started utilizing the Flex Pool on a small scale and will significantly build on these efforts over the course of the year.
The San Francisco Flex Pool is a partnership between the Department of Homelessness and Supportive Housing (HSH), Brilliant Corners, and philanthropy including Tipping Point Community, Dignity Health, and Crankstart. HSH will refer eligible individuals into the Flex Pool. Brilliant Corners will identify landlords and property owners who have vacant units available, support prospective tenants through the leasing process, and provide housing retention services to tenants throughout the duration of their lease. Tenants will contribute 30% of their income towards their rent, while receiving rental subsidies and supportive services that help them stay housed for the long term. Philanthropic dollars will pay for the first 18 months of Flex Pool operations.
""We are committed to securing permanent homes for as many of the people who have been sheltered as a result of COVID-19 as we possibly can. The Flex Pool is an important step in fulfilling that commitment,"" said Abigail Stewart-Kahn, Interim Director of the Department of Homeless and Supportive Housing.
""The combination of supportive services and rent subsidies is a sustainable formula for securing the housing people need to be healthy,"" said Ashley Brand, system director of community and homeless health for CommonSpirit Health and Dignity Health. ""As a health system, we have a mission to improve health, especially for people who are vulnerable, and we're grateful for partnerships like this that help those struggling to find a safe place to live.""
Data shows that homelessness and COVID-19 both disproportionately impact the Black community. As the City lifts shelter-in-place restrictions, this program will ensure that hundreds of our most vulnerable unhoused residents, many of whom are Black and at greater risk for contracting COVID-19, secure permanent homes where they can better protect their health. The partners are committed to ensuring that the Flex Pool plays a role in reducing the racial disparities among San Francisco's homeless population.
""To truly demonstrate our commitment to racial equality, we must make good on our promise to secure housing for the many Black people who have been disproportionately impacted by homelessness for years, even decades,"" said Chris Block, Tipping Point's Chronic Homelessness Initiative Director.
Given the current rental market, it is less expensive to lease apartments in many neighborhoods than it is to pay nightly hotel rates. By moving people out of hotels, the program will free up more space for people who are currently on our streets to access hotel rooms, while expanding the supply of supportive housing throughout San Francisco.
""Flexible housing subsidy pools are the most efficient model for matching people to existing housing resources. While it can take three to five years to build a new 50-unit affordable building, a Flex Pool can house 200 people or more in a matter of months – and help them to stay housed,"" said William F. Pickel, CEO of Brilliant Corners.
The City has already moved some people into permanent housing through the Flex Pool, including Roland Limjoco, 47, who had been homeless for several years and moved into his new studio in early June.
""I feel less stressed now... I was so stressed every day. It was hard being homeless. I remember the times I was staying on the street, and I had a really bad experience. I was so excited when I moved in. Here in my new place it is great, quiet, and I have a nice view. I never had this before. I also now have an elevator which is great due to my knee problems,"" said Limjoco.
About All In
The All In campaign is a diverse coalition focused on solutions to homelessness in San Francisco. The campaign's first call to action is to secure homes for 1,100 people experiencing homelessness throughout San Francisco's 11 supervisorial districts. Solving homelessness is a shared responsibility that requires involvement from the entire City. As one of the wealthiest and most innovative cities in the world, we have the resources and ingenuity to address homelessness boldly and compassionately. Now is the moment to go all in. https://www.sfallin.org/
About Tipping Point Community
Tipping Point's mission is to break the cycle of poverty for people in the Bay Area who don't have the resources to meet their basic needs. Since 2005, Tipping Point has raised more than $260 million for early childhood, education, employment, and housing solutions in the region. Our board covers 100% of our operating costs, so every dollar donated goes where it's needed most. Last year, we helped more than 130,000 people take steps out of poverty.
Visit www.tippingpoint.org to learn more. https://tippingpoint.org/homelessness
This press release was produced by the Office of the San Francisco Mayor. The views expressed here are the author's own."
31,/california/san-francisco/san-francisco-announces-temporary-pause-next-phase-reopening-amid-rise,2020-07-08T06:15:52Z,San Francisco Temporary Pause In Next Phase,0,0,Press Release Desk,News Partner,"Press release from the Office of the San Francisco Mayor:
July 07, 2020
Businesses currently allowed to be open can continue operating, including outdoor dining and indoor retail; indoor dining and outdoor bars will not move forward on July 13; other business activities slated for Phase 2C are being evaluated
San Francisco, CA – Mayor London N. Breed and Director of Health Dr. Grant Colfax announced today that the City will temporarily delay allowing indoor dining and outdoor bars to reopen on July 13, due to a rise in COVID-19 transmission, cases and hospitalizations in San Francisco.
The City is currently evaluating other businesses that had been proposed to reopen between June 29 and July 13, including hair salons, barber shops, indoor museums, outdoor pools, gyms, real estate open houses by appointment, and zoos, as part of the Phase 2C reopening. An update on the status of reopening these businesses will be provided by the end of the week. Businesses and activities that are currently allowed may continue operating at this time. The City continues to encourage San Franciscans to avoid gatherings and wear face coverings when leaving home, and to get tested for COVID-19.
""We know the pause on reopening is disappointing, but it is in the best interest of public health,"" said Mayor Breed. ""We'll continue to make decisions based on the data and the situation in our city, and in the meantime, we all need to do our part to keep each other safe and healthy. That means wearing face coverings, keeping your distance from others, and getting tested. We know that is what is needed in order to get us to a place where we can safely resume reopening.""
As of this morning, San Francisco had recorded 4,020 cases of COVID-19, and 50 deaths. One of the key indicators of COVID-19 prevalence in the city, the number of new cases per day per 100,000 people, had risen to 6.1, well above the goal of 1.8 and a sharp rise since we began reopening on May 18, when it was 3.5. The rate of increase in hospitalizations of COVID-19 patients is also a key indicator that affects the pace of reopening. Our goal is to keep that rate below 10%, and today's indicator shows an increase of 25%. Our hospital capacity, which includes the percentage of acute care and ICU beds that are available, is currently within acceptable range at 35% for acute care beds and 30% for ICU, but could be quickly filled in a surge of COVID-19 cases. Modeling indicates that the reproductive rate of the virus is climbing above 1, meaning that each person with COVID-19 is infecting more than 1 other person and contributing to a rapid spread of the virus that could overwhelm our hospital system, as it has in other parts of the state and country.
""When we examine the health indicators, the regional picture, and what we are learning about the reproductive rate of COVID-19 in our community, we are forced to conclude that it would not be responsible to move forward with indoor dining or outdoor bars on Monday,"" said Dr. Colfax. ""We understand the importance of planning for businesses, and the urgent need that all residents have to get back to work and the new normal. However, the virus has no timeline and spreads quickly when people gather, and we must do everything we can to slow the spread. We also know that safely reopening San Francisco, with a healthy population and a renewed economy, is still possible as long as we all do our part.""
The gradual reopening of local businesses has been on pause since June 26 and will resume when the data indicate that conditions have improved.
""Even though a pause in reopening is disappointing, the resurgence we see in cases and hospitalizations reminds us of why it's important not to lose sight that we are in the middle of an active global pandemic and why it's critical that we approach reopening in a measured way driven by facts on the ground,"" said Assessor Carmen Chu, co-chair of the Economic Recovery Task Force. ""We must continue to do everything we can to support our local economy and small businesses while protecting the health of workers and the public — as individuals, this means keeping safe distances and wearing face coverings.""
""To support the safe reopening of our economy, and for the benefit of workers and small businesses, it is vital we take countermeasures anytime we see the virus reasserting itself in our community,"" said Joaquín Torres, Director of the Office of Economic and Workforce Development. ""Every single day counts now, and it's up to all of us to protect San Francisco's safety and economy. If we take simple, personal precautions – wear a face covering, wash our hands frequently and keep socially distant – we can quickly, collectively slow the spread, and get back to the important business of reopening.""
More than 20 California counties have been placed on a state ""watch list"" and some have already had to roll back their reopening. San Francisco is not currently on that list, but several other Bay Area counties are, and because we are part of an interdependent region, our situation is linked together with theirs. San Francisco could join the list if we do not slow the spread of the virus and see a decrease in new cases and hospitalizations. While many San Franciscans avoided gatherings and wore face coverings over the Fourth of July holiday, we may see an increase in cases in the next two to three weeks linked to those who did not follow these safe practices. Everyone's behavior matters now if we want to slow the spread of the virus and continue reopening.
More information about the reopening timeline can be found at https://sf.gov/step-by-step/reopening-san-francisco.
This press release was produced by the Office of the San Francisco Mayor. The views expressed here are the author's own."
32,/california/san-francisco/statement-mayor-london-breed-supervisor-shamann-walton-death-six-year-old,2020-07-07T08:07:00Z,San Francisco: Death Of Six-Year-Old Jace Young,0,0,Press Release Desk,News Partner,"Press release from the Office of the San Francisco Mayor:
July 06, 2020
San Francisco, CA – ""There are no words that will ease the pain of the senseless killing of a six-year-old boy. Our prayers are with the family of Jace Young at this moment, along with his friends and his entire community.
But make no mistake: thoughts and prayers are not enough.
We must do more. The surging Black Lives Matter Movement is about ending police violence, but it's also about more than that. It's about investing in our Black children's lives and ending the gun violence that continues from generation to generation, because a boy like Jace Young should have been able to grow up safely in his own community. We must hold ourselves accountable and end this viscous cycle. We must talk to our children, talk to our extended families, talk to our loved ones, talk about the cruel death of a six-year-old boy. We must address the systemic factors that continue to perpetuate this senseless loss of life.
Because the loss of any life is tragic, but losing a six-year-old child to gun violence rips at the heart of our city. Jace Young was at the very beginning of his life. A resident of Huntersview, he was a bright light in the neighborhood. He was a little boy who should have been given the opportunity to go to school, play with his friends, and lead a life that would make his family proud. Instead, he was brutally gunned down on the Fourth of July. This Black child's life mattered!
Growing up in San Francisco, we both saw too many people killed by gun violence. We saw the anger, despair and hopelessness that swallowed our communities in the wake of this irreparable damage. We saw mothers weeping and fathers broken. We both dedicated our lives to changing the circumstances that systematically put Black people in harm's way. Clearly, we must do more.
When we talk about supporting the African-American community, we have to remember the young people like Jace who have the right to live their lives in peace. Black kids deserve the opportunities to grow up and thrive just like every other kid. But as long as the weapons and the violence – and the complacency – continue to disproportionately bear down on the Black community, those opportunities will too often drown in our own blood.
We have to take a closer look at how we are investing in our communities so that we are actually making a difference in the lives of Black people. It's not just about marching. It's about doing the hard work after the march, engaging practically and constructively to lift people up out of the cycle of poverty and violence that has ripped us apart for far too long.
This cannot be business as usual. We must put down the guns – everyone must put down the guns – and turn our sights on the long, hard work ahead. We must change the conditions and the institutions that have failed the Black community. And that starts with us. We must be the change.""
This press release was produced by the Office of the San Francisco Mayor. The views expressed here are the author's own."
33,/california/san-francisco/mayor-london-breed-nominates-malia-cohen-serve-police-commission,2020-07-07T07:47:33Z,Malia Cohen To Serve On The Police Commission,0,0,Press Release Desk,News Partner,"Press release from the Office of the San Francisco Mayor:
July 06, 2020
Cohen, member of the California State Board of Equalization, would bring experience advocating for social justice and police reform to the Commission
San Francisco, CA — Mayor London N. Breed today announced that she is nominating Malia M. Cohen to serve on the Police Commission, the seven-member body charged with setting policy for the Police Department and conducting disciplinary hearings when police conduct charges are filed.
""I am proud to nominate Malia M. Cohen to the Police Commission. The recent high-profile killings of Black Americans by police officers has focused the nation's attention on the urgent need to rethink the role that police play in our communities, and this is an issue that Malia has been a leader on her whole career,"" said Mayor Breed. ""Whether it was fighting to create the Department of Police Accountability or pushing to end the use of chokeholds by the Police Department, Malia has consistently advocated for, and won, significant reforms to policing in San Francisco in order to keep people safe. I'm confident that she'll continue to move this issue forward on the Police Commission.""
""It is an honor to partner with Mayor Breed and our communities to rethink and improve the delivery of law enforcement services in San Francisco,"" said Malia Cohen. ""I look forward to joining with our Board of Supervisors, SFPD Chief William Scott, the men and women of his Department, and all who have fought to bring about decent and reformed law enforcement that puts the lives and well-being of all San Franciscans first. My hope is that all who come into contact with the SFPD, particularly African Americans and persons of color, will be treated with respect, and that the Mayor's reforms will build bridges and become a model for our country during these troubled times.""
Cohen served as the Chair of the California State Board of Equalization (BOE) in 2019, and she is the first African-American woman to serve on the Board. As a member of the BOE, Cohen represents nearly 10 million constituents in Northern and Central California. Prior to serving on the BOE, she was President of the San Francisco Board of Supervisors, where she represented District 10 for eight years and was Chair of the Budget and Finance Committee.
Throughout her life, Cohen has fought for diversity and inclusion. As a member of the Board of Supervisors, Cohen was instrumental in banning the use of chokeholds by the San Francisco Police Department. In 2016, she led the effort to create the independent Department of Police Accountability, with expanded powers to audit the police department and investigate all police shootings. In addition to her leadership on police reform, Cohen has championed policies and programs that protect public health, foster economic development, promote new affordable housing, and that create good jobs.
Cohen was born and raised in San Francisco. She earned a Bachelor of Arts degree in Political Science from Fisk University, a historically Black university in Nashville, Tennessee, and a Masters in Science in Public Policy and Management from Carnegie Mellon University in Pittsburgh, Pennsylvania. She resides in the Bayview neighborhood with her husband, attorney Warren Pulley.
Earlier this month, Mayor Breed announced a roadmap to fundamentally change the nature of policing in San Francisco and issued a set of policies to address structural inequities. She proposed four priorities to achieve this vision: ending the use of police in response to non-criminal activity; addressing police bias and strengthening accountability; demilitarizing the police; and promoting economic justice. These policies build on the City's ongoing work to meet the standards contained in President Obama's 2015 Task Force on 21st Century Policing.
This press release was produced by the Office of the San Francisco Mayor. The views expressed here are the author's own."
