,url,Date,Title,Thank,Reply,author,title,context
17,/connecticut/stafford-willington/stafford-willington-election-results-2018-voting-begins,2018-11-06T11:00:00Z,Stafford/Willington Election Results 2018,0,0,Chris Dehnel,Patch Staff,"STAFFORD/WILLINGTON, CT — A steady stream of voters went to the polls in Stafford and Willington on Tuesday to cast ballots in Connecticut's 2018 statewide election.
The big news was Vernon mayor Dan Champagne appearing to take the 35th District state Senate seat vacated by retiring Stafford icon Tony Guglielmo.
Here's how the district voted:
Democratic U.S. Rep. Joe Courtney had an overwhelming lead for re-election as the returns started pouring in throughout the 2nd Congressional District.
Here's how Willington voted:
In Willington, here are the results for the state and local races:
Judge of Probate
35th Senate
53rd House
See how Willington voted in the other races here.
Here's how Stafford voted:
35th Senate
52nd House
Probate Judge
With Somers result delayed until Wednesday, McCaffrey has been declared the winner, 10,528 to 9,097.
See how Stafford voted in opther races here.
Photo Credit: Chris Dehnel"
18,/connecticut/stafford-willington/stafford-willington-election-day-2018-candidates-polling-places,2018-10-26T18:51:43Z,"Election Day 2018: Ballots, Polling Places, Hours",0,0,Chris Dehnel,Patch Staff,"STAFFORD/WILLINGTON, CT — Voters will head to the polls Tuesday Nov. 6 to vote in Connecticut's statewide election. Governor, Lt. governor, state treasurer, state comptroller, attorney general and secretary of the state are all up for grabs. Several local state senate, state house of representative and judge of probate races will also be decided.
Voters also can cast ballots for the U.S. Senate election and congressional races.
Polls are open from 6 a.m. to 8 p.m. Voters who are in line before 8 p.m. will be able to vote even after the deadline passes. You can find your poll location at the Secretary of the State website by inputting your information.
All eyes are on the Governor's race where the choices are: Ned Lamont, Democrat, Bob Stefanowski, Republican, Rodney Hanscomb, Libertarian, Mark Stewart Greenstein, Amigo Constitution Liberty Party, and Oz Griebel, Griebel Frank for CT Party.
The candidates for lieutenant governor are: Susan Bysiewicz, Democrat, Joe Markley, Republican, Jeffrey Thibeault, Libertarian Party, John Demitrus, Amigo Constitution Liberty Party, and Monte E Frank, Griebel Frank for CT Party.
The choices for the U.S. Senate race are: Matthew Corey, Republican Party, Christopher S. Murphy, Democratic Party, Richard Lion, Libertarian Party, and Jeff Russell, Green Party
For the U.S. House of Representatives race, the choices are: Joe Courtney, Democratic Party; and Danny Postemski Jr., Republican Party; Richard Lion, Libertarian Party; Jeff Russell, Green Party.
In the Secretary of the State race the choices are: Denise W Merrill, Democratic Party, Susan Chapman, Republican Party, Heather Lynn Sylvestre Gwynn, Libertarian Party, and Michael DeRosa, Green Party.
In the race for State Treasurer the choices are: Shawn Wooden, Democratic Party, Thad Gray, Republican Party, and Jesse Brohinsky, Libertarian Party.
For the position of State Comptroller the choices are: Kurt Miller, Republican Party, Kevin Lembo, Democratic Party, Paul Passarelli, Libertarian Party, and Edward G Heflin, Green Party.
For the position of Attorney General the choices are: William Tong, Democratic Party, Sue Hatfield, Republican Party, Peter D. Goselin, Green Party.
In Willington and Stafford, for the state Senate, it's Republican Dan Champagne versus Democrat John Perrier. The winner will replace an icon, retiring Sen. Tony Guglielmo.
In Willington, In the state House of Representatives race, it's Republican Sam Belsito against Democrat Pat Wilson Pheanious.
For probate judge, Barbara Gardner Riordan is running unopposed.
In Stafford, In the state House race, it's Republican Kurt Vail against Democrat David Walsh. Linda Louise LaCasse is a petitioning candidate.
For probate judge, Democrat Gina Cekla is running against Republican Carolyn McCaffrey.
Connecticut offers Election Day registration, but those who arrive need to be registered by 8 p.m. in order to vote. Unlike previously registered voters standing in line before 8 p.m. to register won't guarantee the ability to vote.
Absentee ballots are also available for those who won't be in town all of election day or for a multitude of other reasons.
For more election information visit the Milford Registrar's Office by clicking here.
Patch Graphic"
